query,result_rank,title,snippet,link,display_link,formatted_url,search_timestamp
"""Tesco"" ""WhatsApp""",1,Contact Us | Help & Support | Tesco UK,Or try our team during opening hours. WhatsApp 0800 917 7403. Clubcard and Clubcard Plus. How to update your details and get a new Clubcard. Or search our ...,https://www.tesco.com/help/contact,www.tesco.com,https://www.tesco.com/help/contact,2025-08-04T13:19:55.873018
"""Tesco"" ""WhatsApp""",2,can I refuse to use WhatsApp? : r/tesco,"Sep 10, 2024 ... Makes comms much harder but easier for tesco to see it all... Whereas WhatsApp whilst it's encrypted chats, tesco can't watch over it, hence the ...",https://www.reddit.com/r/tesco/comments/1fdkjru/can_i_refuse_to_use_whatsapp/,www.reddit.com,https://www.reddit.com/r/tesco/comments/.../can_i_refuse_to_use_whatsapp...,2025-08-04T13:19:55.873018
"""Tesco"" ""WhatsApp""",3,Help | Tesco.com,"Contact us. Try Little Helper, our virtual assistant. It can answer your questions about shopping, Clubcard and more. Available on: WhatsApp: 0800 917 7403 ...",https://www.tesco.com/help,www.tesco.com,https://www.tesco.com/help,2025-08-04T13:19:55.873018
"""Tesco"" ""WhatsApp""",4,WhatsApp Messages from Manager : r/tesco,"Feb 1, 2022 ... Skip to main content WhatsApp Messages from Manager : r/tesco ... Just leave the WhatsApp tesco social media policys are strictly against this.",https://www.reddit.com/r/tesco/comments/shux8y/whatsapp_messages_from_manager/,www.reddit.com,https://www.reddit.com/r/tesco/.../whatsapp_messages_from_manager/,2025-08-04T13:19:55.873018
"""Tesco"" ""WhatsApp""",5,"Tesco on X: ""@MrGB81 Hi. Send us a WhatsApp message using ...","May 31, 2022 ... Tesco · @Tesco. Hi. Send us a WhatsApp message using 0800 9177 403 from your mobile phone. Liz.",https://x.com/Tesco/status/1531582669502484481?lang=en,x.com,https://x.com/Tesco/status/1531582669502484481?lang=en,2025-08-04T13:19:55.873018
"""Tesco"" ""WhatsApp""",6,"Every little helps @tesco Call, text or email to make a formal ...","Jun 3, 2025 ... ... WhatsApp: +44800 917 7403 Email: store service.ost@tesco.com TAKE ACTION: 1.Call Tesco 2.Demand they remove Israeli products that are ...",https://www.instagram.com/reel/DKchQ_oNas0/,www.instagram.com,https://www.instagram.com/reel/DKchQ_oNas0/,2025-08-04T13:19:55.873018
"""Tesco"" ""WhatsApp""",7,WhatsApp scam: How to avoid the fake Tesco and Asda trick ...,"Nov 6, 2017 ... Fake vouchers for high street stores including Marks & Spencer, Tesco and Asda are being shared on WhatsApp - and they could leave you skint.",https://www.independent.co.uk/life-style/whatsapp-scam-tesco-asda-vouchers-how-to-spot-avoid-messages-links-crime-a8041096.html,www.independent.co.uk,https://www.independent.co.uk/.../whatsapp-scam-tesco-asda-vouchers-how...,2025-08-04T13:19:55.873018
"""Tesco"" ""WhatsApp""",8,"WhatsApp supermarket voucher scams are back ! So far we've seen ...","Nov 6, 2017 ... WhatsApp supermarket voucher scams are back ! So far we've seen Marks & Spencer, Tesco and Asda variations! Don't click the link or forward ...",https://www.facebook.com/actionfraud/posts/whatsapp-supermarket-voucher-scams-are-back-so-far-weve-seen-marks-spencer-tesco/1886285688055802/,www.facebook.com,https://www.facebook.com/.../whatsapp...tesco/1886285688055802/,2025-08-04T13:19:55.873018
"""Tesco"" ""WhatsApp""",9,"Order Easily – Contact Us via WhatsApp, WeChat, Phone & Email ...","Ordering Just Got Easier—Now Available via WhatsApp, WeChat & More! — View Details · Search · Shop By Department · Contact Us · Blogs · Tesco store logo · ( ...",https://tescobs.com/pages/quickorder,tescobs.com,https://tescobs.com/pages/quickorder,2025-08-04T13:19:55.873018
"""Tesco"" ""WhatsApp""",10,WhatsApp: How the supermarket voucher scam works - BBC News,"Nov 7, 2017 ... The messenger app was used to send fake vouchers to people, purporting to be from trusted chains such as Asda, Tesco and Aldi. The messages ...",https://www.bbc.co.uk/news/uk-41900814,www.bbc.co.uk,https://www.bbc.co.uk/news/uk-41900814,2025-08-04T13:19:55.873018
"site:www.tesco.com ""WhatsApp""",1,Help | Tesco.com,"Contact us. Try Little Helper, our virtual assistant. It can answer your questions about shopping, Clubcard and more. Available on: WhatsApp: 0800 917 7403 ...",https://www.tesco.com/help,www.tesco.com,https://www.tesco.com/help,2025-08-04T13:19:57.078550
"site:www.tesco.com ""WhatsApp""",2,Contact Us | Help & Support | Tesco UK,Or try our team during opening hours. WhatsApp 0800 917 7403. Clubcard and Clubcard Plus. How to update your details and get a new Clubcard. Or search our ...,https://www.tesco.com/help/contact,www.tesco.com,https://www.tesco.com/help/contact,2025-08-04T13:19:57.078550
"site:www.tesco.com ""WhatsApp""",3,Samsung Galaxy Tab A9 64GB WiFi Graphite - Tesco Groceries,"... (WhatsApp and normal teste) and makes WhatsApp calls, I am using it more and more each day as the larger screen that my phone makes it so much easier to use ...",https://www.tesco.com/groceries/en-GB/products/316940792,www.tesco.com,https://www.tesco.com/groceries/en-GB/products/316940792,2025-08-04T13:19:57.078550
"site:www.tesco.com ""WhatsApp""",4,Delivery Saver | Tesco - Homepage,"Still have questions? We're trialling the WhatsApp messaging service to answer questions about your Delivery Saver account or our plans. You can send us a ...",https://www.tesco.com/deliverysaver,www.tesco.com,https://www.tesco.com/deliverysaver,2025-08-04T13:19:57.078550
"site:www.tesco.com ""WhatsApp""",5,Terms and conditions - Clubcard - Tesco Groceries,"If the deceased had Christmas Savers top-up value on their account, we require proof of beneficiary or power of attorney by post or screenshot via WhatsApp.",https://www.tesco.com/groceries/en-GB/zone/clubcard-terms-and-conditions,www.tesco.com,https://www.tesco.com/groceries/en-GB/.../clubcard-terms-and-conditions,2025-08-04T13:19:57.078550
"site:www.tesco.com ""WhatsApp""",6,Absurdle - Tesco Groceries,"Are you the nerdle who''s obsessed with sharing your Wordle streak?Ever had to mute your dedicated WhatsApp group when you failed to guess the daily word?",https://www.tesco.com/groceries/en-GB/products/330706640,www.tesco.com,https://www.tesco.com/groceries/en-GB/products/330706640,2025-08-04T13:19:57.078550
"site:www.tesco.com ""WhatsApp""",7,Aquarius AQ219 WaterProof Smartwatch with 280Mah Battery and ...,"Aquarius AQ219 WaterProof Smartwatch with 280Mah Battery and 32MB StorageSmart Features:SMS, Facebook, Whatsapp, and Twitter App NotificationsCall ...",https://www.tesco.com/groceries/en-GB/products/330659991,www.tesco.com,https://www.tesco.com/groceries/en-GB/products/330659991,2025-08-04T13:19:57.078550
"site:www.tesco.com ""WhatsApp""",8,University Games Murder Mystery Party Case Files Black Hawk ...,"... WhatsApp or Telegram smartphone applications.This immersive experience allows you to communicate in real-time, sending and receiving crucial information ...",https://www.tesco.com/groceries/en-GB/products/325333366,www.tesco.com,https://www.tesco.com/groceries/en-GB/products/325333366,2025-08-04T13:19:57.078550
"site:www.tesco.com ""WhatsApp""",9,Tesco Finest Santo Domingo Drinking Chocolate 250G - Tesco ...,The bot/WhatsApp offering is useless and tesco store staff are unable to help. Talk about not giving the customer what they want!!!! Report. A Tesco Customer.,https://www.tesco.com/groceries/en-GB/products/300400500,www.tesco.com,https://www.tesco.com/groceries/en-GB/products/300400500,2025-08-04T13:19:57.078550
"site:www.tesco.com ""WhatsApp""",10,Revolution Skin Silk Luminous Serum Foundation F8 - Tesco ...,The foundation glides on beautifully and I got great advice from Revolution on whatsapp about which shade to get as I originally ordered the wrong shade.,https://www.tesco.com/groceries/en-GB/products/325784498,www.tesco.com,https://www.tesco.com/groceries/en-GB/products/325784498,2025-08-04T13:19:57.078550
"""Sainsbury's"" ""WhatsApp""",1,"Digest: WhatsApp to Introduce Ads; Sainsbury's to Launch AI ...","Jun 18, 2025 ... In today's Digest, we cover WhatsApp introducing ads, Sainsbury's launching an AI-powered retail media platform, Disney adding Amazon to ...",https://www.exchangewire.com/blog/2025/06/18/digest-whatsapp-to-introduce-ads-sainsburys-to-launch-ai-powered-retail-media-platform-disney-adds-amazon-to-drax-partnership/,www.exchangewire.com,https://www.exchangewire.com/.../digest-whatsapp-to-introduce-ads-sainsb...,2025-08-04T13:19:58.520884
"""Sainsbury's"" ""WhatsApp""",2,"Alert: Fake WhatsApp messages from Sainsbury's and Topshop ...","Oct 27, 2016 ... Fraudsters are sending out fake Sainsbury's and Topshop voucher deals through WhatsApp that appear to have been sent by a trusted contact.",https://www.actionfraud.police.uk/alert/alert-fake-whatsapp-messages-from-sainsburys-and-topshop,www.actionfraud.police.uk,https://www.actionfraud.police.uk/.../alert-fake-whatsapp-messages-from-sa...,2025-08-04T13:19:58.520884
"""Sainsbury's"" ""WhatsApp""",3,Contact and Speak to Our Dedicated Customer Service Team ...,"Sainsbury's Energy is committed to providing excellent customer service ... You can reach us on WhatsApp between 8am-10pm, 7 days a week, 365 days a ...",https://www.sainsburysenergy.com/contact-us/,www.sainsburysenergy.com,https://www.sainsburysenergy.com/contact-us/,2025-08-04T13:19:58.520884
"""Sainsbury's"" ""WhatsApp""",4,"Juicy Marbles Plant-Based 'Steaks' Launch In Sainsbury's","Sep 30, 2024 ... social/whatsapp social/email. Juicy Marbles has just announced that its plant-based steaks are being rolled out in Sainsbury's. Read more ...",https://plantbasednews.org/lifestyle/food/juicy-marbles-plant-based-steaks-sainsburys/,plantbasednews.org,https://plantbasednews.org/.../juicy-marbles-plant-based-steaks-sainsburys/,2025-08-04T13:19:58.520884
"""Sainsbury's"" ""WhatsApp""",5,"WhatsApp users - beware the £250 Sainsbury's voucher scam","Jan 16, 2017 ... A scam that promises a £250 Sainsbury's gift card for visiting a website is currently doing the rounds on instant messaging app WhatsApp.",https://www.goodhousekeeping.com/uk/consumer-advice/technology/a566295/sainsburys-250-giftcard-whatsapp-scam/,www.goodhousekeeping.com,https://www.goodhousekeeping.com/.../sainsburys-250-giftcard-whatsapp-s...,2025-08-04T13:19:58.520884
"""Sainsbury's"" ""WhatsApp""",6,"Sainsbury's is warning customers about a new gift card scam that is ...","Jan 16, 2017 ... ... WhatsApp. Sainsbury's £250 gift voucher - beware of this shocking WhatsApp scam. EXPRESS.CO.UK. Sainsbury's £250 gift voucher - beware of this ...",https://www.facebook.com/actionfraud/posts/sainsburys-is-warning-customers-about-a-new-gift-card-scam-that-is-currently-bei/1501736146510760/,www.facebook.com,https://www.facebook.com/.../sainsburys-is...a.../1501736146510760/,2025-08-04T13:19:58.520884
"""Sainsbury's"" ""WhatsApp""",7,"Pastificio Liguori Is now Sainsbury's PGI Pasta Supplier - Italianfood ...","Jul 29, 2019 ... Italian food content on WhatsApp. On the sidelines of the Sainsbury's Brand Conference, organized by Atlante – a company that has been operating ...",https://news.italianfood.net/2019/07/29/pastificio-liguori-is-now-sainsburys-pgi-pasta-supplier/,news.italianfood.net,https://news.italianfood.net/.../pastificio-liguori-is-now-sainsburys-pgi-pasta...,2025-08-04T13:19:58.520884
"""Sainsbury's"" ""WhatsApp""",8,"Sainsbury's trials plastic-free avocado pack - Printweek","Jan 16, 2025 ... Sainsbury's is trialling new paper-based packaging for avocados that ... Share LinkedIn Teams WhatsApp Facebook Email X. New packs will ...",https://www.printweek.com/content/news/sainsburys-trials-plastic-free-avocado-pack/,www.printweek.com,https://www.printweek.com/.../sainsburys-trials-plastic-free-avocado-pack/,2025-08-04T13:19:58.520884
"""Sainsbury's"" ""WhatsApp""",9,"Sainsbury's boss says food prices now rising more slowly","Jul 4, 2023 ... Sainsbury's boss says food prices now rising more slowly. 4 ... WhatsApp: +44 7756 165803; Tweet: @BBC_HaveYourSay · Upload pictures or ...",https://www.bbc.com/news/business-66094905,www.bbc.com,https://www.bbc.com/news/business-66094905,2025-08-04T13:19:58.520884
"""Sainsbury's"" ""WhatsApp""",10,"The closure of my childhood Sainsbury's has tipped me over the ...","Mar 17, 2024 ... “Sainsbury's is closing down!” I tell my husband, waving my ... “Sainsbos is closing?!?” I WhatsApp my sister, who will know I mean ...",https://www.theguardian.com/commentisfree/2024/mar/17/childhood-sainsburys-closing-has-tipped-me-over-the-edge,www.theguardian.com,https://www.theguardian.com/.../childhood-sainsburys-closing-has-tipped-...,2025-08-04T13:19:58.520884
"site:www.sainsburys.co.uk ""WhatsApp""",1,"Aptamil Hungry Baby Milk Infant Formula From Birth 800g | Sainsbury's","Visit www.aptaclub.co.uk to contact us via WhatsApp, Facebook Messenger or Live Chat, or call us on 0800 996 1000. We are devoted to providing you and your ...",https://www.sainsburys.co.uk/gol-ui/product/aptamil-hungry-baby-milk-formula-from-birth-800g-7919322-p,www.sainsburys.co.uk,https://www.sainsburys.co.uk/.../aptamil-hungry-baby-milk-formula-from-...,2025-08-04T13:19:59.690992
"site:www.sainsburys.co.uk ""WhatsApp""",2,Aptamil Advanced 1 First Infant Baby Milk Formula Powder From ...,"... WhatsApp, Facebook Messenger or Live Chat ROI : 1 800 22 12 34 (8:30-17:30 Monday-Friday) www.aptaclub.ie or ask@aptaclub.ie. Packaged in a protective ...",https://www.sainsburys.co.uk/gol-ui/product/aptamil-advanced-1-first-infant-baby-milk-powder-800g,www.sainsburys.co.uk,https://www.sainsburys.co.uk/.../aptamil-advanced-1-first-infant-baby-milk-...,2025-08-04T13:19:59.690992
"site:www.sainsburys.co.uk ""WhatsApp""",3,Aptamil Advanced 2 Follow On Baby Milk Formula Powder 6-12 ...,"... WhatsApp, Facebook Messenger or Live Chat ROI : 1 800 22 12 34 (8:30-17:30 Monday-Friday) www.aptaclub.ie or ask@aptaclub.ie. Packaged in a protective ...",https://www.sainsburys.co.uk/gol-ui/product/aptamil-advanced-2-follow-on-milk-powder-800g,www.sainsburys.co.uk,https://www.sainsburys.co.uk/.../aptamil-advanced-2-follow-on-milk-powd...,2025-08-04T13:19:59.690992
"site:www.sainsburys.co.uk ""WhatsApp""",4,Aptamil Comfort Baby Milk Infant Formula From Birth 800g ...,"Visit www.aptaclub.co.uk to contact us via WhatsApp, Facebook Messenger or Live Chat, or call us on 0800 996 1000. Packaged in a protective atmosphere ...",https://www.sainsburys.co.uk/gol-ui/product/aptamil-comfort-baby-milk-formula-from-birth-800g-7919304-p,www.sainsburys.co.uk,https://www.sainsburys.co.uk/.../aptamil-comfort-baby-milk-formula-from-...,2025-08-04T13:19:59.690992
"site:www.sainsburys.co.uk ""WhatsApp""",5,Aptamil 2 Follow On Baby Milk Formula Powder 6-12 Months 800g ...,"Visit www.aptaclub.co.uk to contact us via WhatsApp, Facebook Messenger or Live Chat, or call us on 0800 996 1000. Certified B Corporation. Green Dot.",https://www.sainsburys.co.uk/gol-ui/product/aptamil-follow-on-milk-6-12-months-800g,www.sainsburys.co.uk,https://www.sainsburys.co.uk/.../aptamil-follow-on-milk-6-12-months-800g,2025-08-04T13:19:59.690992
"site:www.sainsburys.co.uk ""WhatsApp""",6,Aptamil Anti Reflux Baby Milk Infant Formula Powder From Birth ...,"Visit www.aptaclub.co.uk to contact us via WhatsApp, Facebook Messenger or Live Chat, or call us on 0800 996 1000. Packaged in a protective atmosphere ...",https://www.sainsburys.co.uk/gol-ui/product/aptamil-anti-reflux-baby-milk-formula-from-birth-800g-7919316-p,www.sainsburys.co.uk,https://www.sainsburys.co.uk/.../aptamil-anti-reflux-baby-milk-formula-fro...,2025-08-04T13:19:59.690992
"site:www.sainsburys.co.uk ""WhatsApp""",7,"Win one of 20,000 holidays with Walkers crisps | Sainsbury's","The system will generate a unique URL that the entrant can share or pass to a specific person via Twitter, Facebook, Whatsapp or email. When the friend ...",https://www.sainsburys.co.uk/shop/gb/groceries/get-ideas/features/features/win-with-walkers-crisps,www.sainsburys.co.uk,https://www.sainsburys.co.uk/shop/gb/groceries/.../win-with-walkers-crisps,2025-08-04T13:19:59.690992
"""Amazon UK"" ""WhatsApp""",1,Book is unavailable in amazon UK and amazon.com even after ...,whatsapp email link. Dnyanesh (Member) asked a question. Edited by Community ... Book is unavailable in amazon UK and amazon.com even after selecting worldwide ...,https://www.kdpcommunity.com/s/question/0D5f4000017rj4BCAQ/book-is-unavailable-in-amazon-uk-and-amazoncom-even-after-selecting-worldwide-territories?language=en_US,www.kdpcommunity.com,https://www.kdpcommunity.com/.../book-is-unavailable-in-amazon-uk-and...,2025-08-04T13:20:00.918206
"""Amazon UK"" ""WhatsApp""",2,Embedding Amazon Previews on Your Website | Story Empire,"Apr 10, 2017 ... (Miracles have been known to happen.) Happily, unlike donating digital gifts (including ebooks), this feature works on both Amazon UK as well as ...",https://storyempire.com/2017/04/10/embedding-amazon-previews-on-your-website/,storyempire.com,https://storyempire.com/.../embedding-amazon-previews-on-your-website/,2025-08-04T13:20:00.918206
"""Amazon UK"" ""WhatsApp""",3,Amazon UK Ads,"Jan 31, 2021 ... whatsapp email link. Mike Harbott (Member) asked a question. January 30, 2021 at 8:58 PM. Amazon UK Ads. I have recently successfully set up ...",https://www.kdpcommunity.com/s/question/0D52T00005HAPauSAH/amazon-uk-ads?language=en_US,www.kdpcommunity.com,https://www.kdpcommunity.com/s/question/.../amazon-uk-ads?language=en...,2025-08-04T13:20:00.918206
"""Amazon UK"" ""WhatsApp""",4,"Amazon. com or Amazon.uk, which for ads","Oct 21, 2019 ... whatsapp email link. Sircaw (Member) asked a question. October 21, 2019 at 4:07 AM. Amazon. com or Amazon.uk, which for ads. Hello everyone ...",https://kdpcommunity.com/s/question/0D52T00004qFM3HSAW/amazon-com-or-amazonuk-which-for-ads?language=en_US,kdpcommunity.com,https://kdpcommunity.com/s/.../amazon-com-or-amazonuk-which-for-ads?...,2025-08-04T13:20:00.918206
"""Amazon UK"" ""WhatsApp""",5,new Flick Filosopher WhatsApp channel - FlickFilosopher.com,"Oct 22, 2024 ... ... WhatsApp channel. I'm tossing up links to all new ... When you purchase or rent almost anything from Amazon US, Amazon Canada, Amazon UK ...",https://www.flickfilosopher.com/2024/10/new-flick-filosopher-whatsapp-channel.html,www.flickfilosopher.com,https://www.flickfilosopher.com/.../new-flick-filosopher-whatsapp-channel....,2025-08-04T13:20:00.918206
"""Amazon UK"" ""WhatsApp""",6,Doro 7030 Unlocked Dual SIM 4G Easy-to-Use Clamshell Mobile ...,Doro 7030 Unlocked Dual SIM 4G Easy-to-Use Clamshell Mobile Phone for Seniors with WhatsApp ... Amazon UK. Amazon UK. Shipped and Sold by. Amazon UK. See more.,https://www.amazon.ae/Doro-Unlocked-Clamshell-WhatsApp-Facebook/dp/B08QJPZ6J4,www.amazon.ae,https://www.amazon.ae/Doro-Unlocked...WhatsApp.../dp/B08QJPZ6J4,2025-08-04T13:20:00.918206
"""Amazon UK"" ""WhatsApp""",7,NEED AMAZON UK INDIVIDUAL ACCOUNT Contact on WhatsApp ...,"Dec 28, 2024 ... NEED AMAZON UK INDIVIDUAL ACCOUNT Contact on WhatsApp 03256477358 Discussion about needing an Amazon UK individual account and a comment ...",https://www.facebook.com/groups/292648330031705/posts/589777153652153/,www.facebook.com,https://www.facebook.com/groups/292648330031705/.../58977715365215...,2025-08-04T13:20:00.918206
"""Amazon UK"" ""WhatsApp""",8,TAPiTAG Connect with us on Whatsapp PVC Tag NFC & QR Code ...,Buy TAPiTAG Connect with us on Whatsapp PVC Tag NFC & QR Code 70mm online on Amazon.ae at best prices. ✓ ... Amazon UK. Amazon UK. Shipped and Sold by. Amazon UK.,https://www.amazon.ae/TAPiTAG-Connect-Whatsapp-Code-70mm/dp/B0BPHSV7CQ,www.amazon.ae,https://www.amazon.ae/TAPiTAG-Connect-Whatsapp.../B0BPHSV7CQ,2025-08-04T13:20:00.918206
"""Amazon UK"" ""WhatsApp""",9,My hs900 drone which I bought from Amazon just after Christmas for ...,"Feb 21, 2025 ... ... WhatsApp AI answers only I've asked them to call I got back a ... Amazon uk don't stock this unit anymore and offered me a refund but I ...",https://www.facebook.com/groups/2406620592977017/posts/3534363193536079/,www.facebook.com,https://www.facebook.com/groups/.../posts/3534363193536079/,2025-08-04T13:20:00.918206
"""Amazon UK"" ""WhatsApp""",10,Amazon UK Gift Cards with Instant Delivery via WhatsApp and Email ...,"Get Amazon UK Gift Cards with instant delivery via WhatsApp, email, and inside the app — at the best prices from Nology Store.",https://nologystore.com/en/categories/amazon-uk,nologystore.com,https://nologystore.com/en/categories/amazon-uk,2025-08-04T13:20:00.918206
"site:www.amazon.co.uk ""WhatsApp""",1,How do I use WhatsApp?!: For iPhone and Android: 1 (How do I use ...,"Buy How do I use WhatsApp?!: For iPhone and Android: 1 (How do I use Technology?!) by Madan, Vanshdeep (ISBN: 9781796721720) from Amazon's Book Store.",https://www.amazon.co.uk/How-use-WhatsApp-Android-Learners/dp/1796721727,www.amazon.co.uk,https://www.amazon.co.uk/How-use-WhatsApp-Android.../1796721727,2025-08-04T13:20:02.105175
"site:www.amazon.co.uk ""WhatsApp""",2,Motorola Moto E5 Play UK SIM-Free whatsapp sim 16GB ...,"Free delivery and returns on eligible orders. Buy Motorola Moto E5 Play UK SIM-Free whatsapp sim 16GB Smartphone, Black at Amazon UK.",https://www.amazon.co.uk/Motorola-Moto-SIM-Free-Smartphone-Black/dp/B07G2G4G9F,www.amazon.co.uk,https://www.amazon.co.uk/Motorola-Moto-SIM-Free.../B07G2G4G9F,2025-08-04T13:20:02.105175
"site:www.amazon.co.uk ""WhatsApp""",3,Whatsapp Phone - Amazon.co.uk,TTfone TT970 Whatsapp 4G Touchscreen Senior Big Button Flip Mobile Phone - With 8MP Camera and Hearing Aid Compatible - Easy and Simple to Use. Options:.,https://www.amazon.co.uk/whatsapp-phone/s?k=whatsapp+phone,www.amazon.co.uk,https://www.amazon.co.uk/whatsapp-phone/s?k=whatsapp+phone,2025-08-04T13:20:02.105175
"site:www.amazon.co.uk ""WhatsApp""",4,Stickers For Whatsapp - Amazon.co.uk,Sticker Gold - Whatsapp Square Icon Self Adhesive Stickers - 3 Size Options - Social Media Work Van Shop Office Sign Graphics Advertising Decal (12cm (1 Pack)).,https://www.amazon.co.uk/stickers-whatsapp/s?k=stickers+for+whatsapp,www.amazon.co.uk,https://www.amazon.co.uk/stickers-whatsapp/s?k=stickers+for+whatsapp,2025-08-04T13:20:02.105175
"site:www.amazon.co.uk ""WhatsApp""",5,How to receive WhatsApp notifications on Amazon - Amazon ...,"You can customize the types of WhatsApp messages (e.g., order or promotional updates) you want to receive in Communication Preferences. Amazon's WhatsApp is for ...",https://www.amazon.co.uk/gp/help/customer/display.html?nodeId=TZJvM20USFlkA03xwj,www.amazon.co.uk,https://www.amazon.co.uk/gp/help/customer/display.html?nodeId...,2025-08-04T13:20:02.105175
"site:www.amazon.co.uk ""WhatsApp""",6,Flip Phone With Whatsapp - Amazon.co.uk,TTfone Titan TT950 Whatsapp Touchscreen Senior Big Button Flip Mobile Phone 2G · 5.05.0 out of 5 stars (1).,https://www.amazon.co.uk/flip-phone-whatsapp/s?k=flip+phone+with+whatsapp,www.amazon.co.uk,https://www.amazon.co.uk/flip-phone-whatsapp/s?k=flip...whatsapp,2025-08-04T13:20:02.105175
"site:www.amazon.co.uk ""WhatsApp""",7,Whatsapp App For Kindle - Amazon.co.uk,Build a Whatsapp Like App in 24 Hours: Create a Cross-Platform Instant Messaging for Android by Arjun Subburaj,https://www.amazon.co.uk/whatsapp-app-kindle/s?k=whatsapp+app+for+kindle,www.amazon.co.uk,https://www.amazon.co.uk/whatsapp-app-kindle/s?k=whatsapp+app...,2025-08-04T13:20:02.105175
"site:www.amazon.co.uk ""WhatsApp""",8,Brick Phone With Whatsapp - Amazon.co.uk,Amazon.co.uk: brick phone with whatsapp. ... TTfone Titan TT950 Whatsapp Touchscreen Senior Big Button Flip Mobile Phone EE Pay As You Go.,https://www.amazon.co.uk/brick-phone-whatsapp/s?k=brick+phone+with+whatsapp,www.amazon.co.uk,https://www.amazon.co.uk/brick-phone-whatsapp/s?k=brick...whatsapp,2025-08-04T13:20:02.105175
"site:www.amazon.co.uk ""WhatsApp""",9,Whatsapp Portal - Amazon.co.uk,Amazon.co.uk: whatsapp portal.,https://www.amazon.co.uk/whatsapp-portal/s?k=whatsapp+portal,www.amazon.co.uk,https://www.amazon.co.uk/whatsapp-portal/s?k=whatsapp+portal,2025-08-04T13:20:02.105175
"site:www.amazon.co.uk ""WhatsApp""",10,Whatsapp For Tablet - Amazon.co.uk,Amazon.co.uk: whatsapp for tablet.,https://www.amazon.co.uk/whatsapp-tablet/s?k=whatsapp+for+tablet,www.amazon.co.uk,https://www.amazon.co.uk/whatsapp-tablet/s?k=whatsapp+for+tablet,2025-08-04T13:20:02.105175
"""Asda"" ""WhatsApp""",1,WhatsApp scam: How to avoid the fake Tesco and Asda trick ...,"Nov 6, 2017 ... Fake vouchers for high street stores including Marks & Spencer, Tesco and Asda are being shared on WhatsApp - and they could leave you skint.",https://www.independent.co.uk/life-style/whatsapp-scam-tesco-asda-vouchers-how-to-spot-avoid-messages-links-crime-a8041096.html,www.independent.co.uk,https://www.independent.co.uk/.../whatsapp-scam-tesco-asda-vouchers-how...,2025-08-04T13:20:03.463402
"""Asda"" ""WhatsApp""",2,WhatsApp: How the supermarket voucher scam works - BBC News,"Nov 7, 2017 ... Scammers are using WhatsApp to ... In the tweet below, the d in Asda has been replaced with đ - another character known as a crossed D.",https://www.bbc.co.uk/news/uk-41900814,www.bbc.co.uk,https://www.bbc.co.uk/news/uk-41900814,2025-08-04T13:20:03.463402
"""Asda"" ""WhatsApp""",3,What uses data on a mobile phone? [Explained] - Asda Mobile,"Apr 24, 2023 ... Using social media and messaging apps, like Facebook, Twitter, and WhatsApp; Streaming videos on platforms such as Netflix or YouTube ...",https://mobile.asda.com/scoop/what-uses-data-mobile-phone,mobile.asda.com,https://mobile.asda.com/scoop/what-uses-data-mobile-phone,2025-08-04T13:20:03.463402
