query,result_rank,title,snippet,link,display_link,formatted_url,search_timestamp
"""Boots UK"" ""WhatsApp""",6,"Boots UK - New Year, same us! Just looking to find the... | Facebook","Jan 1, 2025 ... api.whatsapp.com. CALL CENTER REPRESENTATIVE. 2 mths. Dionne Cunningham. Boots UK why does it take 14 days for your operations team to look at a ...",https://www.facebook.com/BootsUK/posts/new-year-same-us-just-looking-to-find-the-little-lifts-in-each-day-that-bring-us/1128631619302810/?locale=en_GB,www.facebook.com,https://www.facebook.com/BootsUK/.../1128631619302810/?...,2025-08-04T13:20:20.982938
"""Boots UK"" ""WhatsApp""",7,Here is the thing with Indonesian bootmakers ....Especially Fortis ...,"Jun 7, 2024 ... All custom orders are risky in their own way, but fully remote through fucking whatsapp, come on. ... Boots UK. See more. Languages. Français ...",https://www.reddit.com/r/goodyearwelt/comments/1dab3n8/here_is_the_thing_with_indonesian_bootmakers/,www.reddit.com,https://www.reddit.com/r/.../here_is_the_thing_with_indonesian_bootmaker...,2025-08-04T13:20:20.982938
"""Boots UK"" ""WhatsApp""",8,JOHNSTON & MURPHY : UK size 6.5 – Kak Ton Amerika,WhatsApp Image 2022-01-07 at 8.15.34 PM (4). EASTLAND : UK 9.5. RM 195.00. Add ... jpeg · SOREL DUCK BOOTS : UK size 8.5. RM 230.00. Add to Cart. Add to Cart.,https://kaktonamerika.easy.co/products/johnston-murphy-uk-size-6-5,kaktonamerika.easy.co,https://kaktonamerika.easy.co/products/johnston-murphy-uk-size-6-5,2025-08-04T13:20:20.982938
"""Boots UK"" ""WhatsApp""",9,Reflex Active Series 23 Pink Smart Calling Watch - Boots,Boots.com is a trading name of Boots UK Limited. Registered office: Nottingham NG2 3AA.Registered in England: company number 928555. Registered VAT number ...,https://www.boots.com/reflex-active-series-23-pink-smart-calling-watch-10351961,www.boots.com,https://www.boots.com/reflex-active-series-23-pink-smart-calling-watch-10...,2025-08-04T13:20:20.982938
"""Boots UK"" ""WhatsApp""",10,"The military drill that sparked WhatsApp rumours of Queen's death ...","Dec 6, 2019 ... It was the WhatsApp message that convinced millions of people the Queen had died. ... Boots UK, insisting he felt it was an obvious joke. “It went ...",https://www.theguardian.com/uk-news/2019/dec/06/whatsapp-rumours-gibbo-of-queens-death-came-from-yeovil-military-drill,www.theguardian.com,https://www.theguardian.com/.../whatsapp-rumours-gibbo-of-queens-death-...,2025-08-04T13:20:20.982938
"site:www.boots.com ""WhatsApp""",1,Reflex Active Series 23 Pink Smart Calling Watch - Boots,Good features for the price. Nattynoo. a year ago. I was very pleased with my watch until I lost WhatsApp notifications. I have checked all my settings and I ...,https://www.boots.com/reflex-active-series-23-pink-smart-calling-watch-10351961,www.boots.com,https://www.boots.com/reflex-active-series-23-pink-smart-calling-watch-10...,2025-08-04T13:20:22.215177
"site:www.boots.com ""WhatsApp""",2,"Best motivation apps of 2022: fitness, healthy eating & more - Boots","Nov 16, 2021 ... In between the emails and WhatsApp messages that have gone unanswered, it can often feel like a tool for tiredness rather than relaxation.",https://www.boots.com/wellness-advice/healthy-lifestyle/best-motivation-apps,www.boots.com,https://www.boots.com/wellness-advice/healthy.../best-motivation-apps,2025-08-04T13:20:22.215177
"site:www.boots.com ""WhatsApp""",3,Aptamil Advanced 1 First Baby Milk Formula Liquid from Birth 200ml ...,"Visit www.aptaclub.co.uk or www.aptaclub.ie to contact us via WhatsApp, Instagram or Live Chat, or call us on 0800 996 1000 (UK) or 1800221234 (ROI).",https://www.boots.com/aptamil-advanced-1-first-baby-milk-formula-liquid-from-birth-200ml-10198210,www.boots.com,https://www.boots.com/aptamil-advanced-1-first-baby-milk-formula-liquid-...,2025-08-04T13:20:22.215177
"site:www.boots.com ""WhatsApp""",4,Aptamil Anti-Reflux Baby Milk Formula Powder from Birth to 12 ...,"Visit www.aptaclub.co.uk to contact us via WhatsApp, Facebook Messenger or Live Chat, or call us on 0800 996 1000. How to use. Moving to the next stage If ...",https://www.boots.com/aptamil-anti-reflux-from-birth-to-12-months-800g-10248505,www.boots.com,https://www.boots.com/aptamil-anti-reflux-from-birth-to-12-months-800g-...,2025-08-04T13:20:22.215177
"site:www.boots.com ""WhatsApp""",5,Aptamil Comfort Baby Milk Formula Powder from Birth to 12 Months ...,"Visit www.aptaclub.co.uk to contact us via WhatsApp, Facebook Messenger or Live Chat, or call us on 0800 996 1000. How to use. Food for special medical ...",https://www.boots.com/aptamil-comfort-from-birth-to-12-months-800g-10248504,www.boots.com,https://www.boots.com/aptamil-comfort-from-birth-to-12-months-800g-10...,2025-08-04T13:20:22.215177
"site:www.boots.com ""WhatsApp""",6,Aptamil 1 First Infant Milk Formula Multipack from Birth 6 x 200ml ...,"Visit www.aptaclub.co.uk or www.aptaclub.ie to contact us via WhatsApp, Instagram or Live Chat, or call us on 0800 996 1000 (UK) or 1800221234 (ROI).",https://www.boots.com/aptamil-1-first-baby-milk-formula-liquid-from-birth-multipack-6x200ml-10308251,www.boots.com,https://www.boots.com/aptamil-1-first-baby-milk-formula-liquid-from-birt...,2025-08-04T13:20:22.215177
"site:www.boots.com ""WhatsApp""",7,Aptamil Advanced 1 First Infant Milk from Birth 200ml 4s - Boots,"Visit www.aptaclub.co.uk or www.aptaclub.ie to contact us via WhatsApp, Instagram or Live Chat, or call us on 0800 996 1000 (UK) or 1800221234 (ROI).",https://www.boots.com/aptamil-advanced-1-first-infant-milk-from-birth-200ml-4s-10358144,www.boots.com,https://www.boots.com/aptamil-advanced-1-first-infant-milk-from-birth-20...,2025-08-04T13:20:22.215177
"site:www.boots.com ""WhatsApp""",8,Aptamil | Beaker preparation - Boots,"Our midwives, nutritionists and feeding advisors are always on hand to talk about feeding your baby. So if you have a question, just get in touch. WhatsApp: Ask ...",https://www.boots.com/aptamil/aptamil-beaker-preparation,www.boots.com,https://www.boots.com/aptamil/aptamil-beaker-preparation,2025-08-04T13:20:22.215177
"site:www.boots.com ""WhatsApp""",9,Aptamil First Infant Milk from Birth 2 x 600g (1.2kg) - Boots,"Visit www.aptaclub.co.uk to contact us via WhatsApp, Facebook Messenger or Live Chat, or call us on 0800 996 1000. Suitable for. 0-6 Months. How to use.",https://www.boots.com/aptamil-1-first-baby-milk-formula-powder-from-birth-big-pack-1200g-10331246,www.boots.com,https://www.boots.com/aptamil-1-first-baby-milk-formula-powder-from-bir...,2025-08-04T13:20:22.215177
"site:www.boots.com ""WhatsApp""",10,Aptamil 3 Toddler Milk 1-3 years 200ml - Boots,"For personalised advice and support on feeding and parenting, please visit www.aptaclub.co.uk to contact us via WhatsApp, Facebook Messenger or Live Chat ...",https://www.boots.com/aptamil-growing-up-milk-3-1-2-years-200ml-10168445,www.boots.com,https://www.boots.com/aptamil-growing-up-milk-3-1-2-years-200ml-1016...,2025-08-04T13:20:22.215177
"""Kingfisher (B&Q)"" ""WhatsApp""",1,B&Q: Making Itself at Home in Asia,"Jul 31, 2005 ... In 2003, Kingfisher, B&Q's parent company, decided to reappraise its international strategy. ... Whatsapp · X (Twitter) · TikTok · YouTube. fDi ...",https://www.fdiintelligence.com/content/11a6f934-10df-50aa-bfa0-cb9da81f1ec4,www.fdiintelligence.com,https://www.fdiintelligence.com/.../11a6f934-10df-50aa-bfa0-cb9da81f1ec...,2025-08-04T13:20:23.431870
"""Kingfisher (B&Q)"" ""WhatsApp""",2,Kingfisher: B&Q parent company kicks off round of store closures ...,"May 28, 2015 ... Kingfisher: B&Q parent company kicks off round of store closures. By ... WhatsApp · RSS · IBTimes. © Copyright 2025 IBTimes LLC. All Rights ...",https://www.ibtimes.co.uk/kingfisher-bq-parent-company-kicks-off-round-store-closures-1503310,www.ibtimes.co.uk,https://www.ibtimes.co.uk/kingfisher-bq-parent-company-kicks-off-round-...,2025-08-04T13:20:23.431870
"""Kingfisher (B&Q)"" ""WhatsApp""",3,About — Dave Johnson,"... WhatsApp, HSBC Global, Lyle and Scott, Roche, Selfridges, Neom (KSA), Alfa ... Kingfisher (B&Q), Red Mountain, Golden Wonder, Thompson's Water Seal ...",https://www.workbydavejohnson.com/about,www.workbydavejohnson.com,https://www.workbydavejohnson.com/about,2025-08-04T13:20:23.431870
"""Kingfisher (B&Q)"" ""WhatsApp""",4,B&Q and Screwfix owner Kingfisher sees sales jump as closures ...,"Jul 23, 2015 ... Kingfisher: B&Q parent company kicks off round of store closures · UK ... WhatsApp · RSS · IBTimes. © Copyright 2025 IBTimes LLC. All Rights ...",https://www.ibtimes.co.uk/bq-screwfix-owner-kingfisher-sees-sales-jump-closures-continue-1512170,www.ibtimes.co.uk,https://www.ibtimes.co.uk/bq-screwfix-owner-kingfisher-sees-sales-jump-cl...,2025-08-04T13:20:23.431870
"""Kingfisher (B&Q)"" ""WhatsApp""",5,Media centre at B&Q,"Each WhatsApp group had a Hubbub moderator who used open questions and ... Kingfisher, B&Q's parent company, to roll out marketplaces in other markets ...",https://www.diy.com/corporate/about/media-centre,www.diy.com,https://www.diy.com/corporate/about/media-centre,2025-08-04T13:20:23.431870
"""Kingfisher (B&Q)"" ""WhatsApp""",6,Is B&Q trying to be more like IKEA? The DIY stalwart reveals a new ...,"May 17, 2019 ... WhatsApp; snapchat · flipboard; native; 28 shares. Is B&Q trying to ... Kingfisher's B&Q business is currently known in the UK for its large ...",https://www.thisismoney.co.uk/money/markets/article-7037519/Is-B-Q-trying-like-IKEA-DIY-stalwart-reveals-new-scandi-inspired-approach.html,www.thisismoney.co.uk,https://www.thisismoney.co.uk/.../Is-B-Q-trying-like-IKEA-DIY-stalwart-re...,2025-08-04T13:20:23.431870
"""Kingfisher (B&Q)"" ""WhatsApp""",7,The Brilliant Minds Season - Kaave Pour Co Founder & CEO of ...,"Ben Jackson of Klaviyo explains why email still outperforms, how regional channel preferences are shifting (Germany loves WhatsApp ... Kingfisher/B&Q • JD Sports ...",https://creators.spotify.com/pod/profile/theretailpodcast/episodes/The-Brilliant-Minds-Season---Kaave-Pour-Co-Founder--CEO-of-SPACE10--Research-and-Design-Lab-e1upctu,creators.spotify.com,https://creators.spotify.com/.../The-Brilliant-Minds-Season---Kaave-Pour-C...,2025-08-04T13:20:23.431870
"""Kingfisher (B&Q)"" ""WhatsApp""",8,"White outlines C&C plan, Kingfisher to guide retail sales – Daily ...","May 26, 2025 ... ... Kingfisher (B&Q); Q1 figures from Nvidia; OPEC+ meeting. Thursday 29 May ... Whatsapp · BQ, C&C, Kingfisher, Magners, Roger White, Tennent's ...",https://dailybusinessgroup.co.uk/2025/05/white-outlines-cc-plan-kingfisher-to-guide-retail-sales/,dailybusinessgroup.co.uk,https://dailybusinessgroup.co.uk/.../white-outlines-cc-plan-kingfisher-to-gui...,2025-08-04T13:20:23.431870
"""Kingfisher (B&Q)"" ""WhatsApp""",9,Thoughts on CTD prices & redundancies? | | Tilers Forums,"Aug 3, 2023 ... Price matching is going out of the window, they are adopting the kingfisher/b&q business plan. “Spend X amount with us and receive X ...",https://www.tilersforums.com/threads/thoughts-on-ctd-prices-redundancies.103058/,www.tilersforums.com,https://www.tilersforums.com/.../thoughts-on-ctd-prices-redundancies.1030...,2025-08-04T13:20:23.431870
"""Kingfisher (B&Q)"" ""WhatsApp""",10,One for the plumbers. Is there much difference between flomasta ...,"Oct 26, 2024 ... Flomasta is Kingfisher (B&Q, Screwfix etc) own brand. 9 mos. 1. Pete ... WhatsApp at 0848216038. Your help would be greatly appreciated ...",https://www.facebook.com/groups/1821484254786832/posts/3842504142684823/,www.facebook.com,https://www.facebook.com/groups/.../posts/3842504142684823/,2025-08-04T13:20:23.431870
"site:www.diy.com ""WhatsApp""",1,Pack of 10 Silver Cross Tee Section 600mm x 24mm Suspended ...,... WhatsApp: 07429 045544 Feel free to reach out via WhatsApp for inquiries or orders. Additional Offer: Complete Suspended Ceiling Grid System Available ...,https://www.diy.com/departments/pack-of-10-silver-cross-tee-section-600mm-x-24mm-suspended-ceiling-grid-components-ceiling-expert-ltd/0732006077334_BQ.prd,www.diy.com,https://www.diy.com/departments/.../0732006077334_BQ.prd,2025-08-04T13:20:24.614751
"site:www.diy.com ""WhatsApp""",2,Pack of 10 Silver Cross Tee Section 1200mm x 24mm Suspended ...,... for special pricing on bulk orders. Contact Information: Phone/WhatsApp: +44 7429 045544 Feel free to reach out via WhatsApp for any inquiries or orders.,https://www.diy.com/departments/pack-of-10-silver-cross-tee-section-1200mm-x-24mm-suspended-ceiling-grid-componets-ceiling-expert-ltd/0732006077327_BQ.prd,www.diy.com,https://www.diy.com/departments/.../0732006077327_BQ.prd,2025-08-04T13:20:24.614751
"site:www.diy.com ""WhatsApp""",3,Suspended Ceiling Tiles 600 x 600mm Reveal Edge Ceiling Expert ...,"... WhatsApp on 07429045544. Best Suited Environment: Hotel Restaurant, Barbers Shop, Sound Studio, Salon, Beauty Parlour, Retail Shops, Warehouses, Offices ...",https://www.diy.com/departments/suspended-ceiling-tiles-600-x-600mm-reveal-edge-ceiling-expert-ltd/0732006077105_BQ.prd,www.diy.com,https://www.diy.com/departments/...tiles.../0732006077105_BQ.prd,2025-08-04T13:20:24.614751
"site:www.diy.com ""WhatsApp""",4,"Suspended Ceiling Tiles, EasyClean & Wipeable, 1195mm x ...","... %) 100. Thermal conductivity: (W/mK) N/T. PACK OF 6 TILES Cleaning: Yes (with a wet or dry soft cloth). For more details, contact us via WhatsApp: 07429045544.",https://www.diy.com/departments/suspended-ceiling-tiles-easyclean-wipeable-1195mm-x-595mm-for-1200mm-x-600mm-grid-system-white-ceiling-expert-ltd/0732006077174_BQ.prd,www.diy.com,https://www.diy.com/departments/.../0732006077174_BQ.prd,2025-08-04T13:20:24.614751
"site:www.diy.com ""WhatsApp""",5,Panasonic TV50W90AEB 50inch Ultra HD 4K LED SMART Fire TV,"prompt reply from their whatsapp. Chaz_001 - 5 / 5 - 22/06/2025. Excellent Fire TV. It's huge screen! The functionality of the TV though is very good. I was a ...",https://www.diy.com/departments/panasonic-tv50w90aeb-50inch-ultra-hd-4k-led-smart-fire-tv/5025232963225_BQ.prd,www.diy.com,https://www.diy.com/departments/...50inch.../5025232963225_BQ.prd,2025-08-04T13:20:24.614751
"site:www.diy.com ""WhatsApp""",6,5 garden paint ideas at B&Q,"You'll be the envy of the neighbourhood WhatsApp in no time. Looking for some shed colour ideas? Paint your shed in whatever colour your heart desires with ...",https://www.diy.com/ideas--advice/outdoor--garden/garden-design--planning/garden-paint-ideas-adding-outdoor-colour,www.diy.com,https://www.diy.com/ideas.../garden-paint-ideas-adding-outdoor-colour,2025-08-04T13:20:24.614751
"site:www.diy.com ""WhatsApp""",7,"Easy To Use 4G Mobile Phone for The Elderly - Clear, 5.5"" Touch ...","... WhatsApp and Accuweather. Just click and enjoy. Masses of memory! 32GB internal memory, can be increased to 256GB with a TF card (not included), stores all ...",https://www.diy.com/departments/easy-to-use-4g-mobile-phone-for-the-elderly-clear-5-5-touch-screen-big-easy-to-use-icons-sim-free/5056789422378_BQ.prd,www.diy.com,https://www.diy.com/.../easy-to.../5056789422378_BQ.prd,2025-08-04T13:20:24.614751
"site:www.diy.com ""WhatsApp""",8,Ramco 600R Gold Defender Bollard Fully Installed At Your Chosen ...,We may need some images of the area - We use WhatsApp or Email. We agree a date and time that suits you. Our installation engineer will attend site on that ...,https://www.diy.com/departments/ramco-600r-gold-defender-bollard-fully-installed-at-your-chosen-location/5060003641964_BQ.prd,www.diy.com,https://www.diy.com/departments/ramco.../5060003641964_BQ.prd,2025-08-04T13:20:24.614751
"site:www.diy.com ""WhatsApp""",9,Media centre at B&Q,"Each WhatsApp group had a Hubbub moderator who used open questions and prompts throughout to build engagement, achieving high participation levels across ...",https://www.diy.com/corporate/about/media-centre,www.diy.com,https://www.diy.com/corporate/about/media-centre,2025-08-04T13:20:24.614751
"""Currys"" ""WhatsApp""",1,How to retrieve deleted messages on iPhone | Currys,"Feb 25, 2025 ... Follow these steps to recover your important chats WhatsApp chats: Check for the latest chat backup on iCloud in your WhatsApp settings. If you' ...",https://www.currys.co.uk/techtalk/mobile/tips-and-updates/how-to-retrieve-deleted-messages-iphone.html,www.currys.co.uk,https://www.currys.co.uk/.../how-to-retrieve-deleted-messages-iphone.html,2025-08-04T13:20:25.856463
"""Currys"" ""WhatsApp""",2,Currys updated their webchat to include AI that analyses. Every ...,"Jun 2, 2025 ... Currys updated their webchat to include AI that analyses. ... AI pre-installata su WhatsApp: l'Antitrust ha avviato un'istruttoria ...",https://www.reddit.com/r/assholedesign/comments/1l1lx03/currys_updated_their_webchat_to_include_ai_that/,www.reddit.com,https://www.reddit.com/.../currys_updated_their_webchat_to_include_ai_th...,2025-08-04T13:20:25.856463
"""Currys"" ""WhatsApp""",3,"Hi here's my story about Currys, I purchased a 55 inch Hisense TV ...","Oct 3, 2022 ... ... Currys Tech team, no problem Ian, it's a power management issue with ... whatsApp Shalom on 0661798728 . Pliz note all my services are ...",https://www.facebook.com/groups/236641798563023/posts/459641149596419/,www.facebook.com,https://www.facebook.com/groups/236641798563023/.../45964114959641...,2025-08-04T13:20:25.856463
"""Currys"" ""WhatsApp""",4,How to use a massage gun | Currys,"Jan 16, 2025 ... All without moaning that your legs feel like they're about to fall off. The team WhatsApp chat will thank you… What does a massage gun do though ...",https://www.currys.co.uk/techtalk/kitchen-and-home/how-to-use-massage-gun.html,www.currys.co.uk,https://www.currys.co.uk/techtalk/kitchen.../how-to-use-massage-gun.html,2025-08-04T13:20:25.856463
"""Currys"" ""WhatsApp""",5,Deaf Awareness Week | Currys PLC,"... WhatsApp etc. I'm lucky I'm able to harness modern communication tools! What inspired you to join the crew at Stevenage Distribution Centre at Currys? I ...",https://www.currysplc.com/news-media/stories-insights/2023/deaf-awareness-week/,www.currysplc.com,https://www.currysplc.com/news-media/stories.../deaf-awareness-week/,2025-08-04T13:20:25.856463
"""Currys"" ""WhatsApp""",6,SAMSUNG Galaxy Watch4 BT with Bixby & Google Assistant - Black ...,"Galaxy Watch4 BT lets you read and reply to texts, WhatsApp messages and ... © Currys Group Ltd, 1 Portal Way, London, W3 6RS. Company registration ...",https://business.currys.co.uk/catalogue/cameras-smart-tech/smart-watches-fitness/samsung-galaxy-watch4-bt-with-bixby-google-assistant-black-40-mm/N614875W,business.currys.co.uk,https://business.currys.co.uk/catalogue/cameras...bt.../N614875W,2025-08-04T13:20:25.856463
"""Currys"" ""WhatsApp""",7,Currys plc continues to boss the organic social engagement and I ...,"Mar 7, 2025 ... Currys plc ... Partnerships | CPaas | WhatsApp Business Platform | Chatbots | Conversational Commerce | Google RCS | A2P Messaging.",https://www.linkedin.com/posts/dan-rubel-2724015_currys-plc-continues-to-boss-the-organic-activity-7303710435818549248-Z2vo,www.linkedin.com,https://www.linkedin.com/.../dan-rubel-2724015_currys-plc-continues-to-b...,2025-08-04T13:20:25.856463
"""Currys"" ""WhatsApp""",8,"LENOVO P12 12.7"" Tablet - 128 GB, Storm Grey - Currys Business","Compatible with mainstream platforms such as Zoom, Teams, WhatsApp, and Google Duo, this revolutionary technology makes video calls an even clearer form of ...",https://business.currys.co.uk/catalogue/computing/tablets/tablet/lenovo-p12-12-7-tablet-128-gb-storm-grey/N636311W,business.currys.co.uk,https://business.currys.co.uk/catalogue/computing/...12.../N636311W,2025-08-04T13:20:25.856463
"""Currys"" ""WhatsApp""",9,Shark Lift Away Currys Shark Hoover Sale Buy SHARK Anti Hair ...,whatsapp messages whatsapp en smartwatch. $30 · fleece jacket eb204. $38 · See all the same products ...,https://gntos.org/?t=84216969011600&mod=5f7f02b7&uri=article.php%3Fid%3D2819022-1090%26name%3Dshark+lift+away+currys+shark+hoover+sale,gntos.org,https://gntos.org/?t=84216969011600&mod...uri...lift...currys...,2025-08-04T13:20:25.856463
"""Currys"" ""WhatsApp""",10,"UK's Biggest Brand Movers (November 2023): Currys PC World tops","Nov 22, 2023 ... Currys PC World gained upticks in 11 out of 13 YouGov BrandIndex metrics ... June UK Advertisers of the month: WhatsApp, Head & Shoulders and Oral ...",https://business.yougov.com/content/47929-uks-biggest-brand-movers-november-2023-currys-pc-world-tops,business.yougov.com,https://business.yougov.com/.../47929-uks-biggest-brand-movers-novembe...,2025-08-04T13:20:25.856463
"site:www.currys.co.uk ""WhatsApp""",1,How to retrieve deleted messages on iPhone | Currys,"Feb 25, 2025 ... Follow these steps to recover your important chats WhatsApp chats: Check for the latest chat backup on iCloud in your WhatsApp settings. If you' ...",https://www.currys.co.uk/techtalk/mobile/tips-and-updates/how-to-retrieve-deleted-messages-iphone.html,www.currys.co.uk,https://www.currys.co.uk/.../how-to-retrieve-deleted-messages-iphone.html,2025-08-04T13:20:27.079087
"site:www.currys.co.uk ""WhatsApp""",2,RCS Messaging - what does it mean? | Currys,"Apr 2, 2024 ... In 2022, only 36 billion SMS messages got sent. Yes, that's still a ton of texts but with messaging services like Whatsapp offering way more ...",https://www.currys.co.uk/techtalk/mobile/phone-features/rcs-messaging.html,www.currys.co.uk,https://www.currys.co.uk/techtalk/mobile/phone.../rcs-messaging.html,2025-08-04T13:20:27.079087
"site:www.currys.co.uk ""WhatsApp""",3,Choosing a phone for an older person | Currys,"Mar 11, 2020 ... ... WhatsApp pre-installed. Shop for Doro smartphones. One more thing… pick a SIM. Don't forget that you'll also need a SIM card to get your phone ...",https://www.currys.co.uk/techtalk/mobile/choosing-a-phone-for-an-older-user.html,www.currys.co.uk,https://www.currys.co.uk/techtalk/.../choosing-a-phone-for-an-older-user.ht...,2025-08-04T13:20:27.079087
"site:www.currys.co.uk ""WhatsApp""",4,DORO Mobile Phones - DORO SIM Free Flip Phones | Currys,"The phone can also connect to your home Wi-Fi, making it simple to stay in touch with loved ones via WhatsApp and Facebook, and has a 5 MP camera for taking ...",https://www.currys.co.uk/phones/mobile-phones/mobile-phones/doro,www.currys.co.uk,https://www.currys.co.uk/phones/mobile-phones/mobile-phones/doro,2025-08-04T13:20:27.079087
"site:www.currys.co.uk ""WhatsApp""",5,How to use a massage gun | Currys,"Jan 16, 2025 ... All without moaning that your legs feel like they're about to fall off. The team WhatsApp chat will thank you… What does a massage gun do though ...",https://www.currys.co.uk/techtalk/kitchen-and-home/how-to-use-massage-gun.html,www.currys.co.uk,https://www.currys.co.uk/techtalk/kitchen.../how-to-use-massage-gun.html,2025-08-04T13:20:27.079087
"site:www.currys.co.uk ""WhatsApp""",6,5 amazing things you can do with your smartwatch | Currys,"Nov 19, 2021 ... ... Whatsapp to stay up to date with their mates. And you can do exactly that on the Watch4?* Wear OS Powered by Samsung's clean and simple UI ...",https://www.currys.co.uk/techtalk/smart-tech/wearable-ideas/5-amazing-things-you-can-do-with-your-smartwatch.html,www.currys.co.uk,https://www.currys.co.uk/.../5-amazing-things-you-can-do-with-your-smart...,2025-08-04T13:20:27.079087
"site:www.currys.co.uk ""WhatsApp""",7,Ray-Ban Meta smart glasses: hands-on review | Currys,"Dec 18, 2023 ... All in all, it took less than 5 minutes. I then connected to WhatsApp and Spotify Tap, which lets you play music by tapping the glasses without ...",https://www.currys.co.uk/techtalk/smart-tech/wearable-ideas/ray-ban-meta-smart-glasses-review.html,www.currys.co.uk,https://www.currys.co.uk/techtalk/.../ray-ban-meta-smart-glasses-review.ht...,2025-08-04T13:20:27.079087
"site:www.currys.co.uk ""WhatsApp""",8,Buy DORO 1380 - Black | Currys,"All good but it would have nice with more than 2 GB , whatsapp and internet. Probably in future. Show scores. Share. verified. Published on. 30 August 2023. 1",https://www.currys.co.uk/products/doro-1380-black-10257811.html,www.currys.co.uk,https://www.currys.co.uk/products/doro-1380-black-10257811.html,2025-08-04T13:20:27.079087
"site:www.currys.co.uk ""WhatsApp""",9,Meta Ray-Ban | Currys,"hands-free. Add a new perspective to video calls by using the camera on your glasses to share your POV, like an epic view.*. *Facebook or WhatsApp account ...",https://www.currys.co.uk/brand/meta/meta-ray-ban.html,www.currys.co.uk,https://www.currys.co.uk/brand/meta/meta-ray-ban.html,2025-08-04T13:20:27.079087
"site:www.currys.co.uk ""WhatsApp""",10,How to choose a tablet for schoolwork | Currys,"Nov 29, 2024 ... Easy communication: With Wi-Fi connectivity, you can use apps like Zoom and WhatsApp to collaborate on projects with classmates over video calls ...",https://www.currys.co.uk/techtalk/computing/tablet-and-ipad-reviews/how-to-choose-a-tablet-for-schoolwork.html,www.currys.co.uk,https://www.currys.co.uk/.../how-to-choose-a-tablet-for-schoolwork.html,2025-08-04T13:20:27.079087
"""Next"" ""WhatsApp""",1,WhatsApp Blog,"Welcome to the WhatsApp Blog, your source for WhatsApp news and app updates ... Next. Download · WhatsApp Main Logo. Download. What we do.",https://blog.whatsapp.com/,blog.whatsapp.com,https://blog.whatsapp.com/,2025-08-04T13:20:28.294049
"""Next"" ""WhatsApp""",2,"WhatsApp Web ""Next chat"" hotkey collision with Windows 10 - Super ...","Mar 5, 2023 ... I have found some new WhatsApp Web keyboard shortcuts, which include the missing ""Next chat"" shortcut. I have not been able to test all of ...",https://superuser.com/questions/1772113/whatsapp-web-next-chat-hotkey-collision-with-windows-10,superuser.com,https://superuser.com/.../whatsapp-web-next-chat-hotkey-collision-with-win...,2025-08-04T13:20:28.294049
