query,result_rank,title,snippet,link,display_link,formatted_url,search_timestamp
"""Marks & Spencer"" ""WhatsApp""",6,Marks & Spencer Size - XL Price - 45GH¢ DM/WhatsApp to order ...,"Nov 5, 2023 ... Marks & Spencer Size - XL Price - 45GH¢ DM/WhatsApp to order 0207792910 / 0540698557 Delivery is available nationwide for an additional ...",https://www.facebook.com/iweargh/posts/marks-spencer-size-xlprice-45ghdmwhatsapp-to-order-0207792910-0540698557-deliver/1098916154768257/,www.facebook.com,https://www.facebook.com/...45ghdmwhatsapp.../1098916154768257/,2025-08-04T13:20:11.304077
"""Marks & Spencer"" ""WhatsApp""",7,"U.K. Retailers Harrods, Marks & Spencer Attacked by Cyber Hackers","May 2, 2025 ... ... WhatsApp · Share this article on Email; Print this article; Share this ... Marks & Spencer · retail. Newsletters. Sign up for WWD news straight ...",https://wwd.com/business-news/retail/uk-retailers-harrods-marks-spencer-attacked-cyber-hackers-1237255976/,wwd.com,https://wwd.com/.../uk-retailers-harrods-marks-spencer-attacked-cyber-hack...,2025-08-04T13:20:11.304077
"""Marks & Spencer"" ""WhatsApp""",8,"WhatsApp promises 'no ads, no games, no gimmicks' after $19bn ...","Feb 20, 2014 ... The Facebook deal now means WhatsApp is more than twice as valuable as the likes of Marks & Spencer and ITV. While the $19bn price tag may ...",https://www.marketingweek.com/whatsapp-promises-no-ads-no-games-no-gimmicks-after-19bn-facebook-acquisition/,www.marketingweek.com,https://www.marketingweek.com/whatsapp-promises-no-ads-no-games-no-...,2025-08-04T13:20:11.304077
"""Marks & Spencer"" ""WhatsApp""",9,MARKS & SPENCER FORECASTS DECLINE IN PROFIT FOR ...,"Jan 15, 1999 ... MARKS & SPENCER FORECASTS DECLINE IN PROFIT FOR YEAR. MARKS & SPENCER ... WhatsApp · Share this article on Email; Print this article; Share this ...",https://wwd.com/fashion-news/fashion-features/feature/article-1082330-1814057/,wwd.com,https://wwd.com/fashion-news/fashion-features/.../article-1082330-181405...,2025-08-04T13:20:11.304077
"""Marks & Spencer"" ""WhatsApp""",10,"Insider launches Integration Hub, WhatsApp Commerce ...","Apr 6, 2023 ... ... Marks & Spencer, Virgin, Burger King, Toyota, Singapore Airlines ... Insider now offers 360-degree WhatsApp solutions starting from WhatsApp ...",https://useinsider.com/news/insider-launches-integration-hub-whatsapp-commerce-personalized-search-and-over-20-new-features/,useinsider.com,https://useinsider.com/.../insider-launches-integration-hub-whatsapp-comme...,2025-08-04T13:20:11.304077
"site:www.marksandspencer.com ""WhatsApp""",1,For Her Birthday E-Gift Card | M&S Collection | M&S,... WhatsApp Thank you. Read more. Helpful? 1. 0. Report Review. Please tell us why you are reporting this review? Submit Cancel. 13 April 2025LauzM25. Verified ...,https://www.marksandspencer.com/treat-yourself-e-gift-card/p/gcp60627327,www.marksandspencer.com,https://www.marksandspencer.com/treat-yourself-e-gift.../gcp60627327,2025-08-04T13:20:12.492256
"site:www.marksandspencer.com ""WhatsApp""",2,Smooth Infusion™ Anti-Frizz Shampoo 200ml | AVEDA | M&S IE,Add +442039363499 to the contact list on your smartphone to reach us fast via whatsapp. 04 November 2022India 575. Verified Purchase. Aveda anti frizz shampoo.,https://www.marksandspencer.com/ie/smooth-infusion-anti-frizz-shampoo-200ml/p/hbp60564214,www.marksandspencer.com,https://www.marksandspencer.com/ie/smooth-infusion.../hbp60564214,2025-08-04T13:20:12.492256
"site:www.marksandspencer.com ""WhatsApp""",3,Smooth Infusion™ Anti-Frizz Shampoo 200ml | AVEDA | M&S,Add +442039363499 to the contact list on your smartphone to reach us fast via whatsapp. 04 November 2022India 575. Verified Purchase. Aveda anti frizz shampoo.,https://www.marksandspencer.com/smooth-infusion-anti-frizz-shampoo-200ml/p/hbp60564214,www.marksandspencer.com,https://www.marksandspencer.com/smooth-infusion-anti.../hbp60564214,2025-08-04T13:20:12.492256
"site:www.marksandspencer.com ""WhatsApp""",4,Clinique Smart Clinical Repair™ Lifting Face + Neck Cream 50ml ...,I contacted Clinique via WhatsApp and asked to provide personal information them told someone would be in touch from 48 hours. Called customer service and ...,https://www.marksandspencer.com/ie/clinique-smart-clinical-repair-lifting-face-neck-cream-50ml/p/hbp60644461,www.marksandspencer.com,https://www.marksandspencer.com/ie/clinique-smart.../hbp60644461,2025-08-04T13:20:12.492256
"site:www.marksandspencer.com ""WhatsApp""",5,Stainless Steel 6L Pressure Cooker | Prestige | M&S,"It appears your query has already been resolved via WhatsApp. If you need further assistance, feel free to reach out to our Consumer Care Team at https ...",https://www.marksandspencer.com/stainless-steel-pressure-cooker/p/hbp23016129,www.marksandspencer.com,https://www.marksandspencer.com/stainless-steel-pressure.../hbp23016129,2025-08-04T13:20:12.492256
"""The Co-operative Group"" ""WhatsApp""",1,"UK's Co-op cyberattack, LabHost domains released, NSO WhatsApp ...","May 2, 2025 ... One of the largest food retailers in the U.K. – its full official name is The Co-operative Group ... How Hackers Are Attacking WhatsApp: A Guide ...",https://www.linkedin.com/pulse/uks-co-op-cyberattack-labhost-domains-released-nso-whatsapp-5dfkc,www.linkedin.com,https://www.linkedin.com/.../uks-co-op-cyberattack-labhost-domains-releas...,2025-08-04T13:20:13.767889
"""The Co-operative Group"" ""WhatsApp""",2,Cyber Attack on British Co-Operative Group - Cybersecurity Insiders,"Apr 30, 2025 ... The Co-Operative Group, commonly known as Co-Op, has issued an ... WhatsApp · Linkedin · Naveen Goud. Naveen Goud is a writer at ...",https://www.cybersecurity-insiders.com/cyber-attack-on-british-co-operative-group/,www.cybersecurity-insiders.com,https://www.cybersecurity-insiders.com/cyber-attack-on-british-co-operativ...,2025-08-04T13:20:13.767889
"""The Co-operative Group"" ""WhatsApp""",3,Co-op schemes surplus falls by more than £600m,"whatsapp-icon; bluesky-icon. Co-op schemes surplus falls by more than £600m. The combined surplus of the Co-operative Group's defined benefit (DB) pension ...",https://www.professionalpensions.com/news/4111705/co-op-schemes-surplus-falls-gbp600m,www.professionalpensions.com,https://www.professionalpensions.com/.../co-op-schemes-surplus-falls-gbp6...,2025-08-04T13:20:13.767889
"""The Co-operative Group"" ""WhatsApp""",4,"Rochdale's co-operative movement celebrates 180th anniversary ...","Dec 21, 2024 ... The Co-operative Group said the fund would both help communities rebuild after going through a range of crises, and encourage sustainable ...",https://www.bbc.co.uk/news/articles/clyv48vd987o,www.bbc.co.uk,https://www.bbc.co.uk/news/articles/clyv48vd987o,2025-08-04T13:20:13.767889
"""The Co-operative Group"" ""WhatsApp""",5,The Train Now Standing at Platform 3 is a Co-op? - Shareable,"Apr 24, 2017 ... WhatsApp; Gmail; Pinterest; Pocket. Mastodon; WeChat; Link ... the Co-operative Group, bless them, and we started doing some early ...",https://www.shareable.net/the-train-now-standing-at-platform-3-is-a-co-op/,www.shareable.net,https://www.shareable.net/the-train-now-standing-at-platform-3-is-a-co-op/,2025-08-04T13:20:13.767889
"""The Co-operative Group"" ""WhatsApp""",6,TIMELINE - The Co-operative Group - Manchester Evening News,Manchester Evening News logo - whatsapp community. Get the latest MEN ... The Co-operative Group completes its merger with the Britannia building society.,https://www.manchestereveningnews.co.uk/business/timeline---the-co-operative-group-6996660,www.manchestereveningnews.co.uk,https://www.manchestereveningnews.co.uk/.../timeline---the-co-operative-g...,2025-08-04T13:20:13.767889
"""The Co-operative Group"" ""WhatsApp""",7,Vote Yes to Motion 4 to continue the partnership between the Co-op ...,"Soon, those of us who regularly shop with the Co-operative Group ('the Co-op ... WhatsApp. Contents. Search. Search. The Co-op Marque · We are a living wage ...",https://party.coop/coopagm21,party.coop,https://party.coop/coopagm21,2025-08-04T13:20:13.768889
"""The Co-operative Group"" ""WhatsApp""",8,"Co-op boss apologises after retailer hit by 'highly sophisticated ...","May 6, 2025 ... Join the Manchester Evening News WhatsApp group HERE. Shirine Khoury-Haq, chief executive of the Co-operative Group, told customers in an ...",https://uk.news.yahoo.com/co-op-boss-apologises-retailer-194340447.html,uk.news.yahoo.com,https://uk.news.yahoo.com/co-op-boss-apologises-retailer-194340447.html,2025-08-04T13:20:13.768889
"""The Co-operative Group"" ""WhatsApp""",9,Vote Yes to Motion 8 to continue the partnership between the Co-op ...,"Soon, those of us who regularly shop with the Co-operative Group ('the Co-op ... WhatsApp. Sign up to hear more about our work. Name*. First Last. Email ...",https://party.coop/coopagm25lab,party.coop,https://party.coop/coopagm25lab,2025-08-04T13:20:13.768889
"""The Co-operative Group"" ""WhatsApp""",10,Co-op Food The Co-operative brand The Co-operative Group ...,"Related png images ; WhatsApp Computer Icons Android Mobile Phones, whatsapp, text, trademark, logo png 500x500px 18.08KB ; phone call logo sketch, Telephone ...",https://www.pngwing.com/en/free-png-xcyrk,www.pngwing.com,https://www.pngwing.com/en/free-png-xcyrk,2025-08-04T13:20:13.768889
"site:www.coop.co.uk ""WhatsApp""",1,Untitled,"",https://www.coop.co.uk/search?query=wiretap+detection+anti+spy%2C%E3%80%902024+TelegramChannel%3AKunghac%E3%80%91jjspy+app%2Cspy+apps+for+phones%2Cusing+mspy%2Cbest+spy+app+for+android+phone%2Cmspy+2+factor+authentication%2Ctop+5+spy+apps+for+android%2Cmspy+cell+phone+tracker%2Cspy+app+v6l%2Cmy+spy+free%2Cbest+whatsapp+spy%2C....bad4&page=89,www.coop.co.uk,https://www.coop.co.uk/search?...whatsapp...,2025-08-04T13:20:14.924068
"site:www.coop.co.uk ""WhatsApp""",2,Building communities of the future together | Co-op Blog,"Sep 26, 2022 ... We held 10 focus groups and spoke to young people over WhatsApp. Read what they told us in this blog. Let's co-operate. Creating our new ...",https://www.coop.co.uk/blog/building-communities-of-the-future-together,www.coop.co.uk,https://www.coop.co.uk/blog/building-communities-of-the-future-together,2025-08-04T13:20:14.924068
"""Lidl"" ""WhatsApp""",1,Chat to us on WhatsApp!,WhatsApp is the quickest way to get your questions answered. Click here ... Lidl Plus · Recipes · Serious Support · Gift Cards · Lidl Listens · Compliance · Data ...,https://customer-service.lidl.ie/SelfServiceIE/s/article/Did-you-know-you-can-contact-our-Customer-Support-team-via-WhatsApp-Click-on-the-icon-below-to-get-started,customer-service.lidl.ie,https://customer-service.lidl.ie/.../Did-you-know-you-can-contact-our-Custo...,2025-08-04T13:20:16.172234
"""Lidl"" ""WhatsApp""",2,Lidl Northern Ireland: Customer Service & Help,WhatsApp is the quickest way to get your questions answered. Click here to ... Please click here to tell us about your recent experience and help make Lidl great.,https://customer-service.lidl-ni.co.uk/SelfServiceNI/s/,customer-service.lidl-ni.co.uk,https://customer-service.lidl-ni.co.uk/SelfServiceNI/s/,2025-08-04T13:20:16.172234
"""Lidl"" ""WhatsApp""",3,Lidl Expands on CX Using WhatsApp - CX Today,"Feb 15, 2021 ... Lidl has announced it is using WhatsApp to expand on its CX delivery. The app is being used by customers to make contact with the supermarket giant.",https://www.cxtoday.com/contact-center/lidl-expands-on-cx-using-whatsapp/,www.cxtoday.com,https://www.cxtoday.com/contact.../lidl-expands-on-cx-using-whatsapp/,2025-08-04T13:20:16.172234
"""Lidl"" ""WhatsApp""",4,Location Weekly: Grocery Store Lidl Deploys WhatsApp Chatbot ...,"Nov 20, 2020 ... ... Lidl's WhatsApp Chatbot helping you plan ahead, Amazon going after the office supply market with Smart Dash Shelf, and Powell's Books ...",https://streetfightmag.com/2020/11/20/location-weekly-grocery-store-lidl-deploys-whatsapp-chatbot/,streetfightmag.com,https://streetfightmag.com/.../location-weekly-grocery-store-lidl-deploys-w...,2025-08-04T13:20:16.172234
"""Lidl"" ""WhatsApp""",5,Lidl launches WhatsApp customer care,"Feb 10, 2021 ... This hugely popular service will now move over to Lidl's main WhatsApp profile and shoppers can get in touch with the Live Chat and Messaging ...",https://www.breakingnews.ie/business/lidl-becomes-first-nationwide-irish-supermarket-to-launch-whatsapp-customer-care-1078727.html,www.breakingnews.ie,https://www.breakingnews.ie/.../lidl-becomes-first-nationwide-irish-superma...,2025-08-04T13:20:16.172234
"""Lidl"" ""WhatsApp""",6,Innovation of the Day | Lidl launched a WhatsApp chatbot to help ...,Ireland-based supermarket Lidl launched a WhatsApp chatbot to help customers find the best times to do their grocery shopping and avoid long lines.,https://www.trendwatching.com/innovation-of-the-day-lidl-launched-a-whatsapp-chatbot-to-help-customers-find-the-best-times-to-do-their-grocery-shopping,www.trendwatching.com,https://www.trendwatching.com/innovation-of-the-day-lidl-launched-a-wha...,2025-08-04T13:20:16.172234
"""Lidl"" ""WhatsApp""",7,Lidl Malta: Offers,"Lidl leaflet offers via WhatsApp, showcasing deals on arachidi and other products. Get it now! Fresh offers every week!",https://www.lidl.com.mt/,www.lidl.com.mt,https://www.lidl.com.mt/,2025-08-04T13:20:16.172234
"""Lidl"" ""WhatsApp""",8,WhatsApp,Lidl: gazetka na WhatsApp. Zeskanuj kod QR. Nie przegap już żadnej ... WhatsApp Lidl Polska: oferty i kody pocztowe. Potwierdź subskrypcję. WhatsApp ...,https://www.lidl.pl/c/whatsapp/s10066094,www.lidl.pl,https://www.lidl.pl/c/whatsapp/s10066094,2025-08-04T13:20:16.172234
"""Lidl"" ""WhatsApp""",9,Contact Us,"Lidl Ireland GmbH / Lidl Northern Ireland Ltd. Main Road, Tallaght, Dublin 24. E-Mail: property.ho@lidl.ie. Customer Service Queries. WhatsApp is the quickest ...",https://property.lidl.ie/contact-us,property.lidl.ie,https://property.lidl.ie/contact-us,2025-08-04T13:20:16.172234
"""Lidl"" ""WhatsApp""",10,Lidl WhatsApp Prospekte: Schnäppchen direkt aufs Handy - Lidl,Mit Lidl WhatsApp Prospekten verpasst du keine Preisknüller mehr! Einfach kostenlos abonnieren und beim nächsten Einkauf sparen!,https://www.lidl.de/c/whatsapp-prospekte/s10015695,www.lidl.de,https://www.lidl.de/c/whatsapp-prospekte/s10015695,2025-08-04T13:20:16.172234
"site:www.lidl.co.uk ""WhatsApp""",1,Save Another Way,Share this content. facebook · whatsapp · X. Share this link. https://open.spotify.com/album/4YWhixEPoerP2UCcNRMld9?si=CvvxO4i4TBm20PmBlJjsEg&context=spotify% ...,https://www.lidl.co.uk/c/save-another-way/s10034373,www.lidl.co.uk,https://www.lidl.co.uk/c/save-another-way/s10034373,2025-08-04T13:20:17.318466
"site:www.lidl.co.uk ""WhatsApp""",2,Customer Privacy Notice,"If you have expressly consented to receiving our Lidl marketing communications (email, SMS, WhatsApp, push notifications), we will use your email address or ...",https://www.lidl.co.uk/c/customer-privacy-notice/s10022952,www.lidl.co.uk,https://www.lidl.co.uk/c/customer-privacy-notice/s10022952,2025-08-04T13:20:17.318466
"""Primark (Associated British Foods)"" ""WhatsApp""",1,Higher Prices Provide Q3 Sales Boost at Primark,"Jun 26, 2023 ... Share this article on Twitter · Share this article on Tumblr · Share this article on Whatsapp · Share this article on Email · Share this article ...",https://sourcingjournal.com/topics/retail/primark-associated-british-foods-abf-raise-profit-expectations-higher-prices-uk-retail-441787/,sourcingjournal.com,https://sourcingjournal.com/.../primark-associated-british-foods-abf-raise-pr...,2025-08-04T13:20:18.588292
"""Primark (Associated British Foods)"" ""WhatsApp""",2,Penneys owner Associated British Foods raises full year outlook ...,"Feb 27, 2023 ... Join The Irish Times on WhatsApp and stay up to date. Sign up to the ... PenneysPrimarkAssociated British Foods. IN THIS SECTION ...",https://www.irishtimes.com/business/2023/02/27/penneys-owner-associated-british-foods-raises-full-year-outlook/,www.irishtimes.com,https://www.irishtimes.com/.../penneys-owner-associated-british-foods-raise...,2025-08-04T13:20:18.588292
"""Primark (Associated British Foods)"" ""WhatsApp""",3,Weekly Update on Fake Apps: 6 Jan - 12 Jan 2025 | Babu Lal,"Jan 12, 2025 ... Join the AppStore Avengers WhatsApp Community to participate in the fight against scammers and help protect users from fake apps. Let's make a ...",https://www.linkedin.com/posts/pooniawalla_weekly-update-on-fake-apps-6-jan-12-jan-activity-7284418926845874176-mKje,www.linkedin.com,https://www.linkedin.com/.../pooniawalla_weekly-update-on-fake-apps-6-ja...,2025-08-04T13:20:18.588292
"""Primark (Associated British Foods)"" ""WhatsApp""",4,How matching Gucci clothing worn by Beyonce and her daughter ...,"Nov 7, 2018 ... Boost: The owner of Primark, Associated British Foods , said its share of the. +9. Boost: The owner of Primark, Associated British Foods ...",https://www.thisismoney.co.uk/money/markets/article-6358043/Primark-says-share-UKs-clothing-market-increased-significantly-year.html,www.thisismoney.co.uk,https://www.thisismoney.co.uk/.../Primark-says-share-UKs-clothing-market-...,2025-08-04T13:20:18.588292
"""Primark (Associated British Foods)"" ""WhatsApp""",5,"Hilary Weston, who helped build Penneys and Brown Thomas, has ...",13 hours ago ... Join The Irish Times on WhatsApp and stay up to date. Sign up to the ... Brown ThomasGalen G WestonPenneysPrimarkAssociated British Foods ...,https://www.irishtimes.com/business/2025/08/03/hilary-weston-who-helped-build-penneys-and-brown-thomas-has-died-aged-83/,www.irishtimes.com,https://www.irishtimes.com/.../hilary-weston-who-helped-build-penneys-an...,2025-08-04T13:20:18.588292
"""Primark (Associated British Foods)"" ""WhatsApp""",6,Primark pone el servicio de recogida en tienda en el radar mientras ...,"Mar 11, 2022 ... Eso nos generará ventas y beneficios"", dijo a Reuters John Bason, director financiero de la propietaria de Primark, Associated British Foods. ""¿ ...",https://es-us.finanzas.yahoo.com/noticias/primark-pone-servicio-recogida-tienda-091818775.html,es-us.finanzas.yahoo.com,https://es-us.finanzas.yahoo.com/.../primark-pone-servicio-recogida-tienda-...,2025-08-04T13:20:18.588292
"""Primark (Associated British Foods)"" ""WhatsApp""",7,Dimite el consejero delegado de Primark tras una acusación de ...,"Mar 31, 2025 ... Whatsapp whatsapp. Paul Marchant ""reconoció su error"", declaró el lunes el propietario de Primark, Associated British Foods.",https://es.euronews.com/business/2025/03/31/dimite-el-consejero-delegado-de-primark-tras-una-acusacion-de-conducta-inapropiada,es.euronews.com,https://es.euronews.com/.../dimite-el-consejero-delegado-de-primark-tras-u...,2025-08-04T13:20:18.588292
"""Primark (Associated British Foods)"" ""WhatsApp""",8,Goals and objectives of Power Supermarkets | UKEssays.com,"Jan 1, 2015 ... Share this: Facebook Twitter Reddit LinkedIn WhatsApp. Introduction ... In July 2005 Primark/Associated British Foods purchased the 120 ...",https://www.ukessays.com/essays/environmental-studies/goals-and-objectives-of-power-supermarkets.php,www.ukessays.com,https://www.ukessays.com/.../goals-and-objectives-of-power-supermarkets....,2025-08-04T13:20:18.588292
"""Primark (Associated British Foods)"" ""WhatsApp""",9,"Detailed Analysis of Primark's Business Strategies","Whatsapp. Analysis of Primark. The analytic understanding ... A 2019 article on Primark reported that the parent company of Primark, Associated British Foods ...",https://www.dissertationhomework.com/samples/assignment-essay-samples/business/a-detailed-analysis-of-primark,www.dissertationhomework.com,https://www.dissertationhomework.com/.../a-detailed-analysis-of-primark,2025-08-04T13:20:18.588292
"""Primark (Associated British Foods)"" ""WhatsApp""",10,"Primark ontslaat CEO na 'ongepast gedrag' | De Tijd","Mar 31, 2025 ... Whatsapp · LinkedIn · E-mail. Bewaar ... In een niet mis te verstane verklaring laat het moederbedrijf van Primark, Associated British Foods ...",https://www.tijd.be/ondernemen/retail/primark-ontslaat-ceo-na-ongepast-gedrag/10600422.html,www.tijd.be,https://www.tijd.be/ondernemen/retail/primark-ontslaat.../10600422.html,2025-08-04T13:20:18.588292
"site:www.primark.com ""WhatsApp""",1,Our Sustainable Christmas Photoshoot | Primark US,"Nov 2, 2020 ... Angel video called each family on WhatsApp to help guide them on how to use the camera, and where and how to pose under the right light to get ...",https://www.primark.com/en-us/a/inspiration/love-your-clothes-for-longer/sustainable-christmas-shoot,www.primark.com,https://www.primark.com/en-us/a/.../love.../sustainable-christmas-shoot,2025-08-04T13:20:19.744830
"site:www.primark.com ""WhatsApp""",2,Our Sustainable Christmas Photoshoot | Penneys IE,"Nov 2, 2020 ... Angel video-called each family via WhatsApp to help guide them on how to use the camera, alongside where and how to pose under the right ...",https://www.primark.com/en-ie/a/inspiration/love-your-clothes-for-longer/sustainable-christmas-shoot,www.primark.com,https://www.primark.com/en-ie/a/.../love.../sustainable-christmas-shoot,2025-08-04T13:20:19.744830
"site:www.primark.com ""WhatsApp""",3,Sesión de fotos navideña sostenible | Primark,"Nov 2, 2020 ... Ángel hizo una videollamada con cada familia a través de WhatsApp para orientarles sobre el uso la cámara e indicarles dónde y cómo posar bajo ...",https://www.primark.com/es-es/a/inspiracion/disfruta-de-tu-ropa-durante-mas-tiempo/sesion-de-fotos-navidena-sostenible,www.primark.com,https://www.primark.com/es-es/a/.../sesion-de-fotos-navidena-sostenible,2025-08-04T13:20:19.744830
"site:www.primark.com ""WhatsApp""",4,Unser nachhaltiges Fotoshooting für die Weihnachtskampagne ...,"Nov 2, 2020 ... Hinter den Kulissen bei unserem Weihnachts-Shooting. Über Videoanrufe mit WhatsApp erklärte Ángel den Familien, wie sie die Kamera verwenden, wo ...",https://www.primark.com/de-at/a/inspiration/liebe-deine-kleidung-laenger/nachhaltiges-shooting-fuer-weihnachten,www.primark.com,https://www.primark.com/de.../nachhaltiges-shooting-fuer-weihnachten,2025-08-04T13:20:19.744830
"site:www.primark.com ""WhatsApp""",5,Shooting spécial Noël très écolo | Primark,"Nov 2, 2020 ... Les coulisses de notre shooting de Noël. Angel a parlé à chaque famille sur WhatsApp en appel vidéo pour les aider à utiliser la caméra, et leur ...",https://www.primark.com/fr-fr/a/inspiration/aimez-vos-vetements-plus-longtemps/shooting-special-noel-tres-ecolo,www.primark.com,https://www.primark.com/fr-fr/a/...vos.../shooting-special-noel-tres-ecolo,2025-08-04T13:20:19.744830
"site:www.primark.com ""WhatsApp""",6,Our Sustainable Christmas Photoshoot | Primark UK,"Nov 2, 2020 ... Angel video-called each family via WhatsApp to help guide them on how to use the camera, alongside where and how to pose under the right ...",https://www.primark.com/en-gb/a/inspiration/love-your-clothes-for-longer/sustainable-christmas-shoot,www.primark.com,https://www.primark.com/en-gb/a/.../love.../sustainable-christmas-shoot,2025-08-04T13:20:19.744830
"site:www.primark.com ""WhatsApp""",7,Il nostro servizio fotografico di Natale sostenibile | Primark,"Nov 2, 2020 ... Angel ha fatto una videochiamata con ogni famiglia su WhatsApp per dare una mano e guidarli nell'uso della macchina fotografica, oltre a ...",https://www.primark.com/it-it/a/ispirazione/ama-i-tuoi-capi-piu-a-lungo/servizio-fotografico-di-natale-sostenibile,www.primark.com,https://www.primark.com/it.../servizio-fotografico-di-natale-sostenibile,2025-08-04T13:20:19.744830
"""Boots UK"" ""WhatsApp""",1,"Kylian Mbappé Match Worn Nike Mercurial Superfly 8 Elite 'Silver ...","Join our Whatsapp Community for exclusive pre-orders ... Join the BC Boots UK Whatsapp Community to gain exclusive access to pre-orders, discounts & updates.",https://bcboots.uk/zh/products/kylian-mbappe-match-worn-nike-mercurial-superfly-8-elite-silver-safari-2020-21,bcboots.uk,https://bcboots.uk/.../kylian-mbappe-match-worn-nike-mercurial-superfly-8...,2025-08-04T13:20:20.982938
"""Boots UK"" ""WhatsApp""",2,US Military Desert Storm Vibram Steel Toe Boots.. Uk 11.5 Us 12.5 ...,"Jun 5, 2024 ... ... likes, 1 comments - gwada_locker on June 5, 2024: ""US Military Desert Storm Vibram Steel Toe Boots.. Uk ... Available Ksh 7000 Call/dm/ whatsapp_+ ...",https://www.instagram.com/p/C7042l2IWC7/,www.instagram.com,https://www.instagram.com/p/C7042l2IWC7/,2025-08-04T13:20:20.982938
"""Boots UK"" ""WhatsApp""",3,Xabi Alonso Match Worn Adidas AdiPure 11PRO 2013/14 – BC ...,"Join our Whatsapp Community for exclusive pre-orders ... Join the BC Boots UK Whatsapp Community to gain exclusive access to pre-orders, discounts & updates.",https://bcboots.uk/zh/products/xabi-alonso-match-worn-adidas-adipure-11pro,bcboots.uk,https://bcboots.uk/zh/.../xabi-alonso-match-worn-adidas-adipure-11pro,2025-08-04T13:20:20.982938
"""Boots UK"" ""WhatsApp""",4,Calling all beauty lovers With over 500 iconic beauty brands and ...,"Sep 25, 2024 ... Boots UK Hi I order from you all the time and have never had a ... WhatsApp call and my issue was resolved. Thank me later Message ...",https://www.facebook.com/BootsUK/posts/-calling-all-beauty-lovers-with-over-500-iconic-beauty-brands-and-more-to-come-i/1033154148850558/,www.facebook.com,https://www.facebook.com/BootsUK/...all.../1033154148850558/,2025-08-04T13:20:20.982938
"""Boots UK"" ""WhatsApp""",5,Feature on homepage – Kak Ton Amerika,WhatsApp Image 2023-12-27 at 11.08.21 AM (1) · THALIA : Sz UK 8.5. RM 130.00 ... WhatsApp Image 2021-12-31 at 11.13.17 (2).jpeg · SOREL DUCK BOOTS : UK size 8.5.,https://kaktonamerika.easy.co/collections/feature-on-homepage?limit=50&page=7&sort=position%2Bdesc,kaktonamerika.easy.co,https://kaktonamerika.easy.co/collections/feature-on-homepage?limit...,2025-08-04T13:20:20.982938
