query,result_rank,title,snippet,link,display_link,formatted_url,search_timestamp
"""Asda"" ""WhatsApp""",4,Action Fraud - WhatsApp supermarket voucher scams are back ! So ...,"Nov 6, 2017 ... WhatsApp supermarket voucher scams are back ! So far we've seen Marks & Spencer, Tesco and Asda variations! Don't click the link or forward ...",https://www.facebook.com/photo.php?fbid=1886285041389200&id=143794692304919&set=a.411244602226592,www.facebook.com,https://www.facebook.com/photo.php?fbid=1886285041389200&id...,2025-08-04T13:20:03.463402
"""Asda"" ""WhatsApp""",5,9 Best Free Messaging Apps (in 2023) - Asda Mobile,"Dec 9, 2022 ... WhatsApp; Snapchat; Slack; Discord; Telegram Messenger; Viber Messenger; Signal; WeChat. Facebook Messenger. Apple · Android. Release date: 2011.",https://mobile.asda.com/scoop/free-messaging-apps,mobile.asda.com,https://mobile.asda.com/scoop/free-messaging-apps,2025-08-04T13:20:03.463402
"""Asda"" ""WhatsApp""",6,Leaving process : r/asda,"May 6, 2024 ... On Monday, send WhatsApp message to my manager and Area manager."" I ... I hate Asda with a passion. Upvote 4. Downvote Reply reply. Award",https://www.reddit.com/r/asda/comments/1clqw7y/leaving_process/,www.reddit.com,https://www.reddit.com/r/asda/comments/1clqw7y/leaving_process/,2025-08-04T13:20:03.463402
"""Asda"" ""WhatsApp""",7,WhatsApp Scams To Look Out for: Updated List & Pictures 2025,"Aug 15, 2024 ... ... ASDA (Image Credit: DG Cars) or a subtle spelling error somewhere in the URL. Asda WhatsApp Scam. How do I Protect Myself? The old mantra “if ...",https://tech.co/news/whatsapp-scams-watch-out,tech.co,https://tech.co/news/whatsapp-scams-watch-out,2025-08-04T13:20:03.463402
"""Asda"" ""WhatsApp""",8,Trying to call in sick but call ends before anyone even answers : r/asda,"Apr 15, 2024 ... Mackem64. • 1y ago. I work at a warehouse and we just dial the shift managers number on whatsapp ... Does this mean I got the job? r/asda icon. r/ ...",https://www.reddit.com/r/asda/comments/1c4us63/trying_to_call_in_sick_but_call_ends_before/,www.reddit.com,https://www.reddit.com/.../asda/.../trying_to_call_in_sick_but_call_ends_be...,2025-08-04T13:20:03.463402
"""Asda"" ""WhatsApp""",9,"WhatsApp Asda SCAM - If you get this £250 free 'voucher' do NOT ...","Nov 7, 2017 ... WhatsApp users are being warned about a free 'voucher' for ASDA that promises £250 money off - but don't be fooled as it's a scam by fraudsters to steal your ...",https://www.express.co.uk/life-style/science-technology/876280/WhatsApp-Asda-SCAM-free-voucher-warning,www.express.co.uk,https://www.express.co.uk/.../WhatsApp-Asda-SCAM-free-voucher-warnin...,2025-08-04T13:20:03.463402
"""Asda"" ""WhatsApp""",10,In Brief: Prime Time For Esteban…ASDA Bid Blocked…Delta ...,"Sep 29, 2003 ... ... WhatsApp · Share this article on Email; Print this article; Share this article on Talk ... ASDA BID BLOCKED: Wal-Mart Stores Inc.'s Asda ...",https://wwd.com/fashion-news/fashion-features/feature/in-brief-prime-time-for-esteban-asda-bid-blocked-delta-revises-figures-717251-1916101/,wwd.com,https://wwd.com/.../in-brief-prime-time-for-esteban-asda-bid-blocked-delta-...,2025-08-04T13:20:03.463402
"site:www.asda.com ""WhatsApp""",1,"A parent's guide to children and the I... | Asda Good Living","Feb 4, 2019 ... Age 8 to 11. What they're into: WhatsApp, video games. young-boy-on-ipad__square. This is the age when kids start asking ...",https://www.asda.com/good-living/article/a-parents-guide-to-children-and-the-internet,www.asda.com,https://www.asda.com/good.../a-parents-guide-to-children-and-the-internet,2025-08-04T13:20:04.647662
"site:www.asda.com ""WhatsApp""",2,Emily Atack shares her top 5 things th... | Asda Good Living,"Sep 30, 2020 ... We have WhatsApp groups and send each other the most stupid stuff! You've spoken honestly about battling depression. How do you help ...",https://www.asda.com/good-living/article/emily-atack-shares-her-top-5-things-which-always-make-her-smile,www.asda.com,https://www.asda.com/.../emily-atack-shares-her-top-5-things-which-always...,2025-08-04T13:20:04.647662
"site:www.asda.com ""WhatsApp""",3,"A bloggers' guide to nailing parenthood | Asda Good Living","Mar 27, 2018 ... ... WhatsApp or Instagram and hundreds of people will respond with similar experiences. Recently, it's been less about perfection and more about ...",https://www.asda.com/good-living/article/meet-the-mum-bloggers,www.asda.com,https://www.asda.com/good-living/article/meet-the-mum-bloggers,2025-08-04T13:20:04.647662
"""Morrisons"" ""WhatsApp""",1,Samy Group launches 20th Morrisons Daily store on Evington Road ...,"Dec 13, 2024 ... May be an image of wine, beer and text. +17. WHATSAPP. Morrisons Daily Franchise. At Morrisons Daily, we're committe... 󰟬. WHATSAPP. 󰍸 · 󰤦 2.",https://www.facebook.com/morrisonsdailyfranchise/posts/%F0%9D%97%A6%F0%9D%97%AE%F0%9D%97%BA%F0%9D%98%86-%F0%9D%97%9A%F0%9D%97%BF%F0%9D%97%BC%F0%9D%98%82%F0%9D%97%BD-%F0%9D%97%B9%F0%9D%97%AE%F0%9D%98%82%F0%9D%97%BB%F0%9D%97%B0%F0%9D%97%B5%F0%9D%97%B2%F0%9D%98%80-%F0%9D%9F%AE%F0%9D%9F%AC%F0%9D%98%81%F0%9D%97%B5-%F0%9D%97%A0%F0%9D%97%BC%F0%9D%97%BF%F0%9D%97%BF%F0%9D%97%B6%F0%9D%98%80%F0%9D%97%BC%F0%9D%97%BB%F0%9D%98%80-%F0%9D%97%97%F0%9D%97%AE%F0%9D%97%B6%F0%9D%97%B9%F0%9D%98%86-%F0%9D%98%80%F0%9D%98%81%F0%9D%97%BC%F0%9D%97%BF%F0%9D%97%B2-%F0%9D%97%BC%F0%9D%97%BB-%F0%9D%97%98%F0%9D%98%83%F0%9D%97%B6%F0%9D%97%BB%F0%9D%97%B4%F0%9D%98%81%F0%9D%97%BC%F0%9D%97%BB-%F0%9D%97%A5%F0%9D%97%BC%F0%9D%97%AE%F0%9D%97%B1-%F0%9D%97%9F%F0%9D%97%B2%F0%9D%97%B6%F0%9D%97%B0%F0%9D%97%B2%F0%9D%98%80%F0%9D%98%81%F0%9D%97%B2%F0%9D%97%BF-this-m/122167790102271192/,www.facebook.com,https://www.facebook.com/morrisonsdailyfranchise/...𝗠𝗼𝗿𝗿𝗶𝘀𝗼𝗻𝘀.../1...,2025-08-04T13:20:06.061613
"""Morrisons"" ""WhatsApp""",2,Are they allowed to do this? : r/Morrisons,"Mar 2, 2025 ... my old boss in a train station m&s used to message me on whatsapp ... r/Morrisons - Current state of Morrisons. 342 upvotes · 21 comments ...",https://www.reddit.com/r/Morrisons/comments/1j1x2gt/are_they_allowed_to_do_this/,www.reddit.com,https://www.reddit.com/r/Morrisons/.../are_they_allowed_to_do_this/,2025-08-04T13:20:06.061613
"""Morrisons"" ""WhatsApp""",3,Morrisons Automotive Services,"Morrisons Automotive Services, Anchorage. 279 likes · 2 were here. -Full ... WHATSAPP. Morrisons Automotive Services. -Full service automotive repairs ...",https://www.facebook.com/Morrisonsautomotiveservices/,www.facebook.com,https://www.facebook.com/Morrisonsautomotiveservices/,2025-08-04T13:20:06.061613
"""Morrisons"" ""WhatsApp""",4,Morrisons Christmas delays extend to second day,"Dec 24, 2024 ... Morrisons Christmas delays extend to second day. 24 December 2024 ... From WhatsApp to Greggs - why is tech going down more? Problems ...",https://www.bbc.com/news/articles/cn8g24qn87no,www.bbc.com,https://www.bbc.com/news/articles/cn8g24qn87no,2025-08-04T13:20:06.061613
"""Morrisons"" ""WhatsApp""",5,Morrisons adopts new accessible toilet sign in 492 stores,Morrisons adopts new accessible toilet sign in 492 stores. Published 01 December 2016. Campaigns. Print. Share. Facebook · Twitter · WhatsApp · LinkedIn.,https://crohnsandcolitis.org.uk/news-stories/news-items/morrisons-to-adopts-accessible-toilet-sign-in-492,crohnsandcolitis.org.uk,https://crohnsandcolitis.org.uk/.../morrisons-to-adopts-accessible-toilet-sign-...,2025-08-04T13:20:06.061613
"""Morrisons"" ""WhatsApp""",6,"Morrisons To Launch 'UK's First Supermarket Vegan Pork Pie'","Nov 6, 2019 ... social/whatsapp social/email. UK supermarket Morrisons is launching what it describes as the UK's first vegan pork pie. According to the ...",https://plantbasednews.org/lifestyle/morrisons-vegan-pork-pie/,plantbasednews.org,https://plantbasednews.org/lifestyle/morrisons-vegan-pork-pie/,2025-08-04T13:20:06.061613
"""Morrisons"" ""WhatsApp""",7,Morrisons bags £270m buy-in deal with Aviva,"May 28, 2025 ... whatsapp-icon; bluesky-icon. Morrisons bags £270m buy-in deal with Aviva. The Morrisons Retirement Saver Plan has bagged a £270m buy-in deal ...",https://www.professionalpensions.com/news/4414183/morrisons-bags-gbp270m-deal-aviva,www.professionalpensions.com,https://www.professionalpensions.com/.../morrisons-bags-gbp270m-deal-av...,2025-08-04T13:20:06.061613
"""Morrisons"" ""WhatsApp""",8,Morrisons Archives • Funnylass,Click to share on WhatsApp (Opens in new window) WhatsApp · Click to share on ... Morrisons namibia Ofsted parenting Quakers Radio 4 Roald Dahl Skipton ...,https://www.funnylass.com/tag/morrisons/,www.funnylass.com,https://www.funnylass.com/tag/morrisons/,2025-08-04T13:20:06.061613
"""Morrisons"" ""WhatsApp""",9,Morrisons unveils new eco-friendly cleaning products ...,"Dec 9, 2021 ... whatsapp-icon · bluesky-icon. Morrisons new range of eco cleaning products includes laundry detergent, anti-bacterial spray,. Image: Morrisons ...",https://www.businessgreen.com/news/4041810/morrisons-unveils-eco-friendly-cleaning-products,www.businessgreen.com,https://www.businessgreen.com/.../morrisons-unveils-eco-friendly-cleaning-...,2025-08-04T13:20:06.061613
"""Morrisons"" ""WhatsApp""",10,"Schemes to suffer in Morrisons takeover, trustees warn",whatsapp-icon · bluesky-icon. Related Topics. Defined Benefit · Morrisons Retirement Saver Plan · Morrisons · Fortress Investment Group · Safeway · Previous ...,https://www.professionalpensions.com/news/4036257/schemes-suffer-morrisons-takeover-trustees-warn,www.professionalpensions.com,https://www.professionalpensions.com/.../schemes-suffer-morrisons-takeove...,2025-08-04T13:20:06.061613
"""Aldi"" ""WhatsApp""",1,"Aldi's store locator, but on WhatsApp : r/webdev","Jul 12, 2025 ... Was in Europe for the last two months and was always looking for Aldi since it's the cheapest. Recently learnt WhatsApp has a request ...",https://www.reddit.com/r/webdev/comments/1lxum6e/aldis_store_locator_but_on_whatsapp/,www.reddit.com,https://www.reddit.com/r/webdev/.../aldis_store_locator_but_on_whatsapp/,2025-08-04T13:20:07.453751
"""Aldi"" ""WhatsApp""",2,Aldi canned tomatoes shakshuka recipe,"Jul 3, 2020 ... Aldi Nerd Community RECIPE GROUP!!! | ... Fanny's kitchen utensils to join the WhatsApp group kindly follow the link https://chat.whatsapp. com/ ...",https://www.facebook.com/groups/887301195001322/posts/1161262937605145/,www.facebook.com,https://www.facebook.com/groups/.../posts/1161262937605145/,2025-08-04T13:20:07.453751
"""Aldi"" ""WhatsApp""",3,"ALDI SÜD WhatsApp Channel oder Chat abonnieren - so geht's ...",2. Melde dich im WhatsApp Chat von ALDI SÜD an. Scanne dazu den QR-Code oben auf der Webseite oder klicke auf den Link zum WhatsApp Chat von ALDI ...,https://www.aldi-sued.de/de/whatsapp.html,www.aldi-sued.de,https://www.aldi-sued.de/de/whatsapp.html,2025-08-04T13:20:07.453751
"""Aldi"" ""WhatsApp""",4,Aldi cinnamon rolls with cream and brown sugar,"Apr 20, 2025 ... Aldi Nerd Community RECIPE GROUP!!! | Aldi ... Created a 5 odd rollover WhatsApp group Join my WhatsApp group here https://chat.whatsapp.",https://www.facebook.com/groups/887301195001322/posts/2444204865977606/,www.facebook.com,https://www.facebook.com/groups/.../posts/2444204865977606/,2025-08-04T13:20:07.453751
"""Aldi"" ""WhatsApp""",5,WhatsApp | ALDI SUISSE,Wie abonniere ich den ALDI SUISSE WhatsApp Service?,https://www.aldi-suisse.ch/de/services/whatsapp.html,www.aldi-suisse.ch,https://www.aldi-suisse.ch/de/services/whatsapp.html,2025-08-04T13:20:07.453751
"""Aldi"" ""WhatsApp""",6,ALDI Nord auf WhatsApp: immer up to date | ALDI Nord,Öffne WhatsApp und wähle unten links in der Leiste „Aktuelles“. · Folge dem Link „Alle anzeigen“ und gib „ALDI Nord“ in das Suchfeld ein. · Jetzt klicke einfach ...,https://www.aldi-nord.de/kundeninformationen/whatsapp.html,www.aldi-nord.de,https://www.aldi-nord.de/kundeninformationen/whatsapp.html,2025-08-04T13:20:07.453751
"""Aldi"" ""WhatsApp""",7,"OVER 23% OF PARTICIPANTS SHOW INTEREST IN ALDI'S NEW ...","Mar 8, 2024 ... Integrating the WhatsApp subscription service into ALDI's activation campaign in Luxembourg effectively drove customer engagement and boosted ...",https://basebuilder.com/wp-content/uploads/2024/12/aldi-case-en.pdf,basebuilder.com,https://basebuilder.com/wp-content/uploads/2024/12/aldi-case-en.pdf,2025-08-04T13:20:07.453751
"""Aldi"" ""WhatsApp""",8,Germany: Aldi distributes leaflets via WhatsApp,"Dec 21, 2022 ... Discount Retail Chain Aldi Nord and Aldi Süd (both German family owned) are now using social media platform WhatsApp to communicate with their customers.",https://www.discountretailconsulting.com/post/germany-aldi-distributes-leaflets-via-whatsapp,www.discountretailconsulting.com,https://www.discountretailconsulting.com/.../germany-aldi-distributes-leaflet...,2025-08-04T13:20:07.453751
"""Aldi"" ""WhatsApp""",9,Aldi distributes leaflet via WhatsApp in Luxembourg - RetailDetail EU,"May 23, 2023 ... Discounter Aldi is going to distribute its leaflets in Luxembourg via WhatsApp, as the country is taking measures to curb the publication of paper leaflets.",https://www.retaildetail.eu/news/food/aldi-verspreidt-folder-via-whatsapp-in-luxemburg/,www.retaildetail.eu,https://www.retaildetail.eu/.../aldi-verspreidt-folder-via-whatsapp-in-luxemb...,2025-08-04T13:20:07.453751
"""Aldi"" ""WhatsApp""",10,Aldi Luxembourg Turns To WhatsApp For Distributing Weekly ...,"May 29, 2023 ... Aldi Luxembourg is distributing its weekly brochure via WhatsApp as it seeks to expand its digital accessibility and cut paper use.",https://www.esmmagazine.com/retail/aldi-luxembourg-turns-to-whatsapp-for-distributing-weekly-brochures-241403,www.esmmagazine.com,https://www.esmmagazine.com/.../aldi-luxembourg-turns-to-whatsapp-for-d...,2025-08-04T13:20:07.453751
"""John Lewis Partnership"" ""WhatsApp""",1,"Sharon White, Chairman of the John Lewis Partnership, to Step Down","Oct 2, 2023 ... ... WhatsApp · Share this article on Email; Print this article; Share this article on Talk. John Lewis Partnership Chair, Sharon White, speaks ...",https://wwd.com/business-news/human-resources/sharon-white-chairman-of-the-john-lewis-partnership-to-step-down-1235855332/,wwd.com,https://wwd.com/.../sharon-white-chairman-of-the-john-lewis-partnership-to...,2025-08-04T13:20:08.806408
"""John Lewis Partnership"" ""WhatsApp""",2,"John Lewis set for 'significantly higher' annual profit as half-year ...","Sep 12, 2024 ... The profit forecast comes as the employee-owned John Lewis Partnership ... Follow Sky News on WhatsApp. Keep up with all the latest news ...",https://news.sky.com/story/john-lewis-set-for-100m-annual-profit-as-half-year-losses-decrease-13213226,news.sky.com,https://news.sky.com/.../john-lewis-set-for-100m-annual-profit-as-half-year...,2025-08-04T13:20:08.806408
"""John Lewis Partnership"" ""WhatsApp""",3,John Lewis to launch legal advice service for staff members,whatsapp-icon; bluesky-icon. The John Lewis Partnership is to launch a new personal legal advice service for its staff. The new service – which will be ...,https://www.professionalpensions.com/news/1437848/john-lewis-launch-legal-advice-service-staff,www.professionalpensions.com,https://www.professionalpensions.com/.../john-lewis-launch-legal-advice-se...,2025-08-04T13:20:08.806408
"""John Lewis Partnership"" ""WhatsApp""",4,John Lewis Partnership,"John Lewis Partnership continues to support its partners with Zendesk ... “Our next step would be to set up a WhatsApp account to integrate with Zendesk,“ ...",https://www.zendesk.com/customer/john-lewis-partnership/,www.zendesk.com,https://www.zendesk.com/customer/john-lewis-partnership/,2025-08-04T13:20:08.806408
"""John Lewis Partnership"" ""WhatsApp""",5,John Lewis Partnership enriches the customer experience with data.,"May 8, 2023 ... Einstein Bots provide fast, convenient answers for website users and those who write in from WhatsApp. Virtual Remote Assistant provides ...",https://www.salesforce.com/resources/customer-stories/john-lewis-trusted-relationships-data-ai/,www.salesforce.com,https://www.salesforce.com/.../john-lewis-trusted-relationships-data-ai/,2025-08-04T13:20:08.806408
"""John Lewis Partnership"" ""WhatsApp""",6,John Lewis & Partners – Apps on Google Play,"• Share the products you love through social media, WhatsApp, email or message ... More by John Lewis Partnership. arrow_forward. Thumbnail image. John Lewis ...",https://play.google.com/store/apps/details?id=com.johnlewis.android&hl=en_GB,play.google.com,https://play.google.com/store/apps/details?id=com.johnlewis.android...,2025-08-04T13:20:08.806408
"""John Lewis Partnership"" ""WhatsApp""",7,John Lewis | J.P. Morgan Asset Management,John Lewis. LinkedIn Twitter Facebook WhatsApp. Web. John Lewis Partnership. Case study. Taking an alternative approach to short-term investing. The largest ...,https://am.jpmorgan.com/us/en/asset-management/liq/insights/liquidity-insights/case-studies/john-lewis-partnership-takes-an-alternative-approach-to-short-term-investing/,am.jpmorgan.com,https://am.jpmorgan.com/.../john-lewis-partnership-takes-an-alternative-app...,2025-08-04T13:20:08.806408
"""John Lewis Partnership"" ""WhatsApp""",8,Better Jobs Programme 2020/21 | John Lewis Partnership,"“The John Lewis Partnership is leading the way on understanding and ... a Whatsapp group. During the pandemic, rucomfy pivoted, manufacturing over ...",https://www.johnlewispartnership.co.uk/content/dam/cws/pdfs/Juniper/ethics-and-sustainability/better-jobs-programme-2020-21.pdf,www.johnlewispartnership.co.uk,https://www.johnlewispartnership.co.uk/.../better-jobs-programme-2020-21...,2025-08-04T13:20:08.806408
"""John Lewis Partnership"" ""WhatsApp""",9,John Lewis builds trusted relationships with data and AI. - Salesforce,"May 8, 2023 ... ... John Lewis Partnership enriches the customer experience with data ... WhatsApp. Virtual Remote Assistant provides clear and timely ...",https://www.salesforce.com/uk/customer-stories/john-lewis-trusted-relationships-data-ai/,www.salesforce.com,https://www.salesforce.com/uk/.../john-lewis-trusted-relationships-data-ai/,2025-08-04T13:20:08.806408
"""John Lewis Partnership"" ""WhatsApp""",10,BRITAIN THROUGH THE,"May 6, 2020 ... 21% HAVE A STREET WHATSAPP. OR MESSAGING GROUP. 12% ARE ... The John Lewis Partnership announces plans to reopen its Lancashire ...",https://www.johnlewispartnership.co.uk/content/dam/cws/pdfs/Juniper/Britain-Through-the-Lockdown-John-Lewis-and-Waitrose-Report.pdf,www.johnlewispartnership.co.uk,https://www.johnlewispartnership.co.uk/.../Britain-Through-the-Lockdown-...,2025-08-04T13:20:08.806408
"site:www.johnlewis.com ""WhatsApp""",1,"Motorola Moto e14 Smartphone, Android, 2GB RAM, 6.5”, 4G, SIM ...",His first smart phone and now using WhatsApp & Facebook for the first time. It has many text & screen size zoom options so easier for him to see and use ...,https://www.johnlewis.com/motorola-moto-e14-smartphone-android-2gb-ram-6-5-4g-sim-free-64gb/pastel-green/p112175987,www.johnlewis.com,https://www.johnlewis.com/motorola-moto-e14...6.../p112175987,2025-08-04T13:20:10.073141
"site:www.johnlewis.com ""WhatsApp""",2,ANYDAY Interview Gemma Cairney | John Lewis & Partners,"The emoji is definitely the awkward grin and the last WhatsApp is cute! It's from the [other owners] of my dog's litter. Daisy is turning one, so we're going to ...",https://www.johnlewis.com/content/home/sara-cox--interview1,www.johnlewis.com,https://www.johnlewis.com/content/home/sara-cox--interview1,2025-08-04T13:20:10.073141
"site:www.johnlewis.com ""WhatsApp""",3,Dan Smith Interview | John Lewis & Partners,"The last WhatsApp I sent was in our band and crew group, which is relentlessly busy with people chatting absolute rubbish because we're on tour at the moment.",https://www.johnlewis.com/content/home/dan-smith-bastille-interview,www.johnlewis.com,https://www.johnlewis.com/content/home/dan-smith-bastille-interview,2025-08-04T13:20:10.073141
"site:www.johnlewis.com ""WhatsApp""",4,"John Lewis Round Tortoiseshell Sunglasses, Brown","You can copy this link into emails, text messages or post it on social media. Share now. X Icon · Facebook Icon · Pinterest Icon · Whatsapp Icon. Tick Icon Free ...",https://www.johnlewis.com/john-lewis-round-tortoiseshell-sunglasses-brown/p112916977,www.johnlewis.com,https://www.johnlewis.com/john-lewis-round-tortoiseshell.../p112916977,2025-08-04T13:20:10.073141
"site:www.johnlewis.com ""WhatsApp""",5,Portal+ (Plus) from Facebook Smart Video Calling Display with 15.6 ...,Portal+ from Facebook is smart video calling with Alexa Built-in. Easily video call friends and family on their smartphones and tablets via their WhatsApp or ...,https://www.johnlewis.com/portal-plus-from-facebook-smart-video-calling-display-with-15-6-screen-alexa/p5047048,www.johnlewis.com,https://www.johnlewis.com/portal-plus-from-facebook.../p5047048,2025-08-04T13:20:10.073141
"site:www.johnlewis.com ""WhatsApp""",6,ANYDAY Interview Ben Bailey Smith | John Lewis & Partners,"What's your most used emoji? Who did you last WhatsApp and what did you say? I can't start my day without Wordle – my last streak was 87, not out ...",https://www.johnlewis.com/content/home/ben-bailey-smith-interview,www.johnlewis.com,https://www.johnlewis.com/content/home/ben-bailey-smith-interview,2025-08-04T13:20:10.073141
"site:www.johnlewis.com ""WhatsApp""",7,ANYDAY Interview Jaime Winston | John Lewis & Partners,"I use the lightning-bolt emoji a lot – for me, it represents cool and I use it with the prayer or the fire heart. My last WhatsApp was arranging a night out at ...",https://www.johnlewis.com/content/home/jaime-winston--interview,www.johnlewis.com,https://www.johnlewis.com/content/home/jaime-winston--interview,2025-08-04T13:20:10.073141
"site:www.johnlewis.com ""WhatsApp""",8,ANYDAY Interview Gemma Cairney | John Lewis & Partners,"My last WhatsApp is actually really weird – it explains how I kind of live in Alice's Wonderland. I have a double decker, open-top yellow bus called ...",https://www.johnlewis.com/content/home/gemma-cairney-interview,www.johnlewis.com,https://www.johnlewis.com/content/home/gemma-cairney-interview,2025-08-04T13:20:10.073141
"site:www.johnlewis.com ""WhatsApp""",9,ANYDAY Interview Isy Suttie | John Lewis & Partners,"What's your most used emoji? Who did you last Whatsapp and what did you say? The emoji that looks like you've just received bad news, but you're going ...",https://www.johnlewis.com/content/home/isy-suttie-interview,www.johnlewis.com,https://www.johnlewis.com/content/home/isy-suttie-interview,2025-08-04T13:20:10.073141
"site:www.johnlewis.com ""WhatsApp""",10,"Google Pixel 9 Smartphone, Android, 6.3”, 5G, SIM Free, 128GB ...","See your last call and message, including ones from WhatsApp, stay updated on upcoming. See your last call and message, including ones from WhatsApp, stay ...",https://www.johnlewis.com/google-pixel-9-smartphone-android-6-3-5g-sim-free-128gb/light-porcelain/p112468813,www.johnlewis.com,https://www.johnlewis.com/google-pixel-9...android.../p112468813,2025-08-04T13:20:10.073141
"""Marks & Spencer"" ""WhatsApp""",1,WhatsApp? Join our School Leavers Programme #recruitment #talent,"WhatsApp? Join our School Leavers Programme #recruitment #talent. At M&S we're really proud of our work with young talent and we want to make our schemes the ...",https://corporate.marksandspencer.com/whatsapp-join-our-school-leavers-programme-recruitment-talent,corporate.marksandspencer.com,https://corporate.marksandspencer.com/whatsapp-join-our-school-leavers-p...,2025-08-04T13:20:11.304077
"""Marks & Spencer"" ""WhatsApp""",2,"Adidas Data Breach, Whatsapp Image Threat, Silent Ransom ...","... Marks & Spencer, Co-op Group, and Harrods lately. WhatsApp auto-download image. Still have the WhatsApp auto-download image feature on? You might be the next ...",https://dmarcreport.com/blog/adidas-data-breach-whatsapp-image-threat-silent-ransom-vishing/,dmarcreport.com,https://dmarcreport.com/.../adidas-data-breach-whatsapp-image-threat-silent...,2025-08-04T13:20:11.304077
"""Marks & Spencer"" ""WhatsApp""",3,How Marks & Spencer continually evolves to deliver meaningful ...,"Feb 11, 2019 ... WhatsApp · Conversations API · RCS · Voice · SIP Trunking · Email API · SMTP ... How Marks & Spencer continually evolves to deliver meaningful ...",https://customers.twilio.com/en-us/marks-and-spencer,customers.twilio.com,https://customers.twilio.com/en-us/marks-and-spencer,2025-08-04T13:20:11.304077
"""Marks & Spencer"" ""WhatsApp""",4,"WhatsApp supermarket voucher scams are back ! So far we've seen ...","Nov 6, 2017 ... WhatsApp supermarket voucher scams are back ! So far we've seen Marks & Spencer, Tesco and Asda variations! Don't click the link or forward ...",https://www.facebook.com/actionfraud/posts/whatsapp-supermarket-voucher-scams-are-back-so-far-weve-seen-marks-spencer-tesco/1886285688055802/,www.facebook.com,https://www.facebook.com/.../whatsapp...are.../1886285688055802/,2025-08-04T13:20:11.304077
"""Marks & Spencer"" ""WhatsApp""",5,Marks & Spencer Launches Vegan Wine Range - Plant Based News,"Apr 7, 2021 ... social/whatsapp social/email. UK Retailer Marks & Spencer is launching a new vegan wine range entitled 'Found'. The new collection features ...",https://plantbasednews.org/lifestyle/food/marks-spencer-launches-vegan-wine-range/,plantbasednews.org,https://plantbasednews.org/.../marks-spencer-launches-vegan-wine-range/,2025-08-04T13:20:11.304077
